key,title,abstract,keywords,authors,year,url,Included,ID
88,Comprehension and Writing Strategy Training Improves Performance on Content-Specific Source-Based Writing Tasks,"Source-based essays are evaluated both on the quality of the writing and the content appropriate interpretation and use of source material. Hence, composing a high-quality source-based essay (an essay written based on source material) relies on skills related to both reading (the sources) and writing (the essay) skills. As such, source-based writing must involve language comprehension and production processes. The purpose of the current study is to examine the impact of reading, writing, and blended (i.e., reading and writing) strategy training on students' performance on a content-specific, source-based essay writing task. In contrast to general source-based writing tasks, content-specific source-based writing tasks are tasks wherein writers are provided the source material on which to base their essays. Undergraduate students (n = 175) were provided with strategy instruction and practice in the context of two intelligent tutoring systems, ""Writing Pal"" and ""Interactive Strategy Training for Active Reading and Thinking"" (iSTART). Results indicated that participants in the blended strategy training condition produced higher quality source-based essays than participants in the reading comprehension-only, writing-only, or control condition, with no differences observed between the latter three conditions. Further, the benefits of this blended strategy instruction remained significant regardless of prior reading and writing skills, or time on task. [This article was published in ""International Journal of Artificial Intelligence in Education"" p1-32 2016.]",Arizona; Competition; Content area writing; Control Groups; Cooperative Learning; Educational Experiments; Essays; Gates MacGinitie Reading Tests; Intelligent tutoring systems; Pretests Posttests; reading comprehension; Reading strategies; Reading Tests; Statistical Analysis; Teaching Methods; time on task; Undergraduate Students; Writing Instruction; Writing Strategies,"Weston-Sementelli, Jennifer L.; Allen, Laura K.; McNamara, Danielle S.",,,1,88
89,Examining the efficacy of using iPod Touches to deliver reading comprehension strategy instruction and to provide electronic text support on the reading comprehension performance of sixth-grade students,"Instructional use of the iPod Touch is increasing as evidenced by anecdotal reports of its efficacy as a learning tool. However, research documenting the impact of this technology has been limited. This study was based on the following research questions: (a) Does providing explicit reading comprehension strategy instruction using an iPod Touch increase students' reading comprehension outcomes based on standardized reading tests and multiple-choice probe measures when compared to a No Support comparison group? (b) Does providing different types of electronic text support increase students' reading comprehension outcomes, and if so, which type of support is most effective? (c) Does providing different levels of electronic text support influence students' attitudes toward the use of comprehension strategies as well as using an iPod Touch for this task? Participants 1d 155 sixth-grade students at a public middle school. Students were randomly assigned to one of three intervention groups; (a) Notational Only support (a note-taking sheet), (b) Notational + Instructional support (embedded prompts), and (c) Notational + Instructional + Translational support (audio version of the text and prompts) and received reading comprehension strategy instruction and text support using an iPod Touch. An intact No Support (N = 61) group that did not receive instruction or text support but read the texts using an iPod Touch was used as a quasi-experimental comparison group. Two standardized reading comprehension measures were employed at pretest and posttest as well as researcher developed probe measures that were used throughout the study. An ANOVA analysis determined that no statistically significant differences existed between the groups at pretest. An ANCOVA with pretest scores as a covariate found no statistically significant differences between groups on the standardized reading comprehension measures. Because of a high level of variation among the probe measure data, including significant missing data, these results were not analyzed statistically and were reported descriptively. Students responded positively to survey questions about using the iPod Touch for summarization strategy instruction and the text supports. (PsycINFO Database Record (c) 2016 APA, all rights reserved)",electronic text support; Elementary School Students; Grade Level; iPod Touches; Middle Schools; Physical Contact; Reading; reading comprehension; reading comprehension performance; sixth-grade students; Strategies; strategy instruction; teaching,"Williams, Marilyn Anne",2011.0,,1,89
90,Training and Generalization Effects of a Reading Comprehension Learning Strategy on Computer and Paper-Pencil Assessments,"Many schools use computer-based testing to measure students' progress for end-of-the-year and statewide assessments. There is little research to support whether computer-based testing accurately reflects student progress, particularly among students with learning, performance, and generalization difficulties. This article summarizes an investigation of a reading strategy on comprehension of expository and narrative text; comprehension was assessed using both paper- and computer-based tasks. Results showed that students increased their learning strategy use and reading comprehension accuracy when using the strategy on computer-based assessments with expository text. Also students generalized their strategy use to paper-pencil assessments with narrative text. Reading comprehension of narrative passages also increased. The results suggest the value of teaching a reading strategy to students who struggle with both paper-pencil and computer-based assessments of comprehension.",Accuracy; Computer Assisted Testing; Elementary School Students; Experimental Groups; Expository Writing; Generalization; intervention; Learning Strategies; reading comprehension; Reading Difficulties; Reading strategies; Teaching Methods; Test Format; United States (Southeast),"Worrell, Jamie; Duffy, Mary Lou; Brady, Michael P.; Dukes, Charles; Gonzalez-DeHass, Alyssa",2016.0,,1,90
91,Effects of an Interactive Computer-Based Reading Strategy on Student Comprehension,"The computer-based testing mode has received limited research as a task condition for elementary students as it relates to comprehension for both narrative and expository text. The majority of schools now use computer-based testing to measure students' progress for end of the year exams. Additionally, schools are also delivering state-wide assessments like the Florida Comprehension Assessment Test through computer-based testing instead of paper-pencil testing. There is little research to indicate whether computer-based assessments are an effective way to measure student progress.    This study investigated the effects of an interactive computer-based reading strategy on student comprehension for both expository and narrative passages. The intervention evaluated students' percentage of learned strategy use and comprehension accuracy for expository computer-based passages. Additionally, the intervention measured whether students generalized the learned strategy when given a paper-pencil narrative passage and whether generalization of strategy use improved comprehension accuracy. This study used an A-B-A-B design across participants, with a follow-up phase. The results from the data showed that all students made significant increases in strategy use from baseline to follow-up. Additionally, all the students had an increase in comprehension accuracy from baseline to follow-up for both computer and paper-based passages. All students were able to generalize successfully the strategy use to narrative passages, and improved their comprehension accuracy of narrative passages. The effects of the study suggest the value of teaching students the interactive computer-based reading strategy for students who struggle with passage comprehension.    [The dissertation citations contained here are published with the permission of ProQuest LLC. Further reproduction is prohibited without permission. Copies of dissertations may be obtained by Telephone (800) 1-800-521-0600. Web page: http://www.proquest.com/en-US/products/dissertations/individuals.shtml.]",Computer Assisted Testing; Computer Uses in Education; educational technology; Elementary School Students; intervention; Program Effectiveness; reading comprehension; reading instruction; Reading Skills; Reading strategies; Teaching Methods,"Worrell, Jamie L.",2011.0,,1,91
92,A collaborative multimedia annotation tool for enhancing knowledge sharing in CSCL,"Knowledge sharing in computer supported collaborative learning (CSCL) requires intensive social interactions among participants, typically in the form of annotations. An annotation refers to an explicit expression of knowledge that is attached to a document to reveal the conceptual meanings of an annotator’s implicit thoughts. In this research, we develop a Semantic Web and Web services-supported multimedia tool to facilitate collaborative annotation sharing in the context of CSCL. Our experimental results demonstrate that our tool can facilitate knowledge sharing and improve participating students’ reading comprehension: it helps participants to raise good questions and provide proper answers through the practice of reading, commenting, reviewing, and discussion. (PsycINFO Database Record (c) 2019 APA, all rights reserved)",collaborative multimedia annotation tool; Computer Assisted Instruction; computer supported collaborative learning; Cooperative Learning; knowledge sharing; Knowledge Transfer; Multimedia; reading comprehension; Semantic Web; Semantics,"Yang, Stephen J. H.; Zhang, Jia; Su, Addison Y. S.; Tsai, Jeffrey J. P.",2011.0,10.1080/10494820.2011.528881,1,92
93,The effect of collaborative annotation on Chinese reading level in primary schools in China,"As school networks get more available, reading instruction in a computer classroom has become more and more popular in China. Although information and communication technology (ICT) has brought about some improvements in classroom teaching, it must be admitted that the phenomenon of fast reading with low-level cognitions is threatening school children’s reading literacy. In order to address this problem, a collaborative annotation tool called Sharing Unique Reading Feeling (SURF) was developed for creating and sharing annotations. This study explored SURF-based collaborative reading instruction, and investigated the effect of collaborative annotation supported by SURF on primary school students’ Chinese reading levels with methods of equal group experiment, interview and comparative analysis. Finally, some suggestions were proposed for the development of instructional annotation tools and the implementation of current reading instruction especially in computer classrooms. Results showed that the collaborative annotation supported by SURF could promote students’ reading performance, enhance their Chinese reading levels in primary schools, and it was also helpful to develop the higher-level cognitive abilities such as analyzing, summarizing and evaluating. (PsycINFO Database Record (c) 2016 APA, all rights reserved)",Chinese reading level; Collaboration; collaborative annotation; Elementary School Students; elementary schools; primary school students; primary schools; Reading Ability; Reading Education; reading instruction; teaching,"Yang, Xianmin; Yu, Shengquan; Sun, Zhong",2013.0,10.1111/j.1467-8535.2011.01277.x,1,93
94,Improving the Expository Reading Comprehension of Students with Disabilities through the Use of the RACE! Process and Class-Wide Peer Tutoring,"The Common Core State Standards (CCSS) have brought about changes in reading instruction in order to better prepare students for post-secondary education and productivity in all career fields. An important feature in the elementary (K-5) CCSS is the increased exposure to informational texts and the requirement for students to read expository selections during 50% of their reading instruction. Students with disabilities tend to be passive readers who either lack the ability to comprehend or fail to activate reading comprehension strategies to access information within textual material. Research has shown students with disabilities often fail to monitor and evaluate their understanding of expository texts. With the changes associated with the CCSS, the need for alternative strategies has come to a forefront. The current study was designed to examine the use of a technologically enhanced reading intervention aligned with CCSS curriculum to improve the overall expository reading comprehension of students with disabilities at the elementary level. This research examines the application of the Read, Ask Questions, Claim, and Evidence (RACE!) process in both peer-mediated and self-regulated conditions. Results suggest the intervention package improved the reading comprehension of students with and without disabilities and was equally successful during self-regulated use. Rates of improvement (ROI) suggest RACE! has the potential to close comprehension gaps in struggling readers. [The dissertation citations contained here are published with the permission of ProQuest LLC. Further reproduction is prohibited without permission. Copies of dissertations may be obtained by Telephone (800) 1-800-521-0600. Web page: http://www.proquest.com/en-US/products/dissertations/individuals.shtml.]",Alignment (Education); Common Core State Standards; Disabilities; instructional effectiveness; intervention; Peer Teaching; reading comprehension; Reading Difficulties; reading instruction; Reading strategies; Technology Uses in Education; Tutoring,"Zgliczynski, Timothy George",2016.0,,1,94
95,Eye Tracking Indicators of Reading Approaches in Text-Picture Comprehension,"Despite numerous studies on reading and multimedia comprehension, the usage of text and picture with different reading strategies has rarely become a focus of research. The current study aims to explore whether the usage of text differs from the usage of picture when readers follow different strategies of knowledge acquisition. In a within-subjects design using eye tracking, seventeen secondary school students comprehended blended text and picture materials with three different strategies. (1) Initial coherence-formation strategy, which requires students to process text and picture unguidedly. (2) Consecutive task-oriented strategy, which requires them to gather information to answer the question (which explains the task) provided after prior experience with text and picture. (3) Initial task-oriented strategy, which requires them to comprehend text and picture to solve the task equipped with the prior information about the question from the beginning. Eye tracking data showed that text and picture play different roles in these processing conditions. (1) The results are in line with the assumption that text (rather than picture) is more likely used to construct mental models in initial coherence-formation processing of text and picture. (2) Students seem to primarily rely on the picture to answer the question after the prior experience with the material with consecutive task-oriented strategy. (3) Text and picture are both used heavily when the question is presented first, enabling students to selectively process question-relevant aspects of the material at first contact.",Accuracy; Cognitive Processes; Educational Experiments; Eye Movements; Foreign Countries; Germany; Hypothesis Testing; Illustrations; Multimedia Instruction; Multimedia Materials; problem solving; Reader Text Relationship; reading comprehension; Reading strategies; Scores; Secondary School Students; Statistical Analysis; Task Analysis; Textbooks,"Zhao, Fang; Schnotz, Wolfgang; Wagner, Inga; Gaschler, Robert",2014.0,,1,95
96,Using the Summarizing Strategy to Engage Learners: Empirical Evidence in an Immersive Virtual Reality Environment,"According to the current literature, it is unknown whether summarizing can enhance learning and engagement in an immersive environment. To fill this gap, we conducted an experimental study to investigate the potential effects of using summarizing strategy in an immersive virtual reality learning environment on comprehension, cognitive load, and intrinsic motivation. Seventy-five college students were randomly assigned to one of the four conditions formed by a 2 × 2 factorial design with the immersive environment (virtual reality vs. interactive video) as one factor and the use of the summarizing strategy (yes vs. no) as the other factor. The results indicated that (a) summarizing significantly reduced learners' perceived effort; (b) summarizing resulted in lower perceived success than not summarizing in the interactive video condition; and (c) learning from the immersive virtual reality environment led to increased interest and value. These findings suggest the use of appropriate strategies in immersive learning environments.",Cognitive Processes; College Students; Computer Simulation; Difficulty Level; Educational Environment; Learner Engagement; Learning Strategies; reading comprehension; Student Motivation,"Zhao, Jian; Lin, Lijia; Sun, Jiangshan; Liao, Yuan",2020.0,,1,96
97,Digital annotation tools and comprehension,"This quantitative, quasi-experimental study posed the question: does using a digital annotation strategy increase high school students' comprehension of expository texts? Using a repeated measures design, this study analyzes students' comprehension test scores with two different types of annotation treatments: handwritten annotations and digital annotations using Microsoft Word Track Changes. It also compares these results to a more traditional note-taking strategy, Cornell Notes. Hypothesized results predicted that students exposed to the digital annotation strategy would have increased comprehension test scores than when using handwritten annotations, or the Cornell Notes strategy. However, results show that when using handwritten annotations, students did better on comprehension tests than they did when using the other two strategies. The results also indicated no interactions between the treatment schedules and comprehension test scores. Lastly, student attitude surveys displayed that motivation is a key factor to consider when choosing an annotation strategy, as more students liked using digital annotations, even though they did not score as high in their tests of comprehension when using this strategy. (PsycINFO Database Record (c) 2017 APA, all rights reserved)",Academic Achievement Motivation; academic motivation; comprehension test scores; Comprehension Tests; digital annotation tools; Test Performance,"Zyrowski, Michelle L.",2017.0,,1,97
98,"Assessing the effectiveness of peer-assisted learning strategies (pals) reading program on sixth-grade students comprehension, fluency, and attitude toward reading, with nonfiction texts","The purpose of the study was to implement and evaluate the effectiveness of the Peer- Assisted Learning Strategies (PALS) supplemental reading program to determine if there was an increase in sixth grade students’ reading comprehension, oral fluency, and attitude toward reading, specifically when reading nonfiction text. One-hundred sixty-four sixth grades students were placed in one of two conditions: PALS treatment or control. A quasi-experimental pretest-posttest design was utilized to compare the effects of treatment between the two groups. Students in the PALS and control groups received the same amount of reading instruction during the 13 weeks of the study. The PALS group received supplemental PALS reading instruction in addition to the district curriculum while the control group used only the district reading curriculum. Quantitative data were collected from pre and post-test measures for reading comprehension (Scholastic Reading Inventory and DIBELS Daze), fluency (DIBELS ORF), and attitude toward reading (Elementary Reading Attitude Survey). Qualitative data were collected in the form of reflection posts from an online site called Kidblog, and a teacher interview protocol. Findings did not reveal any statistical difference in reading comprehension, fluency, or attitude between PALS and control groups. However, both PALS and control groups showed positive gains in comprehension and fluency over the course of the study which suggested teaching reading comprehension strategies can assist students with nonfiction texts. (PsycINFO Database Record (c) 2016 APA, all rights reserved)",Computer Assisted Instruction; Learning Strategies; oral fluency; Peers; Reading; reading comprehension; reading comprehension strategies; sixth-grade students comprehension; suggested teaching reading; teacher interview protocol; Treatment Effectiveness Evaluation,"Abbondanza, Mark A.",2015.0,,1,98
99,"From Quantitative Results to Qualitative Meaning: A Look at Renzulli Learning through the Eyes of Students, Teachers, and Administrators at Oak Hills Elementary School and Inman Middle School","This article summarizes an experimental study that investigated the use of Renzulli Learning on oral reading fluency, reading comprehension, science achievement, and social studies achievement among 383 elementary and middle schools students. The Renzulli Learning System is an online educational learning system and profiler designed to match student interests, learning styles, and expression styles with highly challenging enrichment resources. Students were randomly assigned to use Renzulli Learning for 2-3 hours each week for 16-weeks, and those students who participated demonstrated significantly higher growth in reading comprehension, oral reading fluency, and social studies achievement than control group students who did not participate in Renzulli Learning.",Administrators; Cognitive Style; Computer Assisted Instruction; Elementary School Students; Elementary School Teachers; Enrichment; Middle School Students; Middle School Teachers; reading comprehension; Reading Fluency; Science Achievement; Social Studies; Student Interests; Teaching Methods,"Field, Gara B.",2010.0,,1,99
100,"Effects of classroom practices on reading comprehension, engagement, and motivations for adolescents","We investigated the roles of classroom supports for multiple motivations and engagement in students' informational text comprehension, motivation, and engagement. A composite of classroom contextual variables consisting of instructional support for choice, importance, collaboration, and competence, accompanied by cognitive scaffolding for informational text comprehension, was provided in four‐week instructional units for 615 grade 7 students. These classroom motivational‐engagement supports were implemented within integrated literacy/history instruction in the Concept‐Oriented Reading Instruction (CORI) framework. CORI increased informational text comprehension compared with traditional instruction (TI) in a switching replications experimental design. Students' perceptions of the motivational‐engagement supports were associated with increases in students' intrinsic motivation, value, perceived competence, and increased positive engagement (dedication) more markedly in CORI than in TI, according to multiple regression analyses. Results extended the evidence for the effectiveness of CORI to literacy/history subject matter and informational text comprehension among middle school students. The experimental effects in classroom contexts confirmed effects from task‐specific, situated experimental studies in the literature. (PsycINFO Database Record (c) 2019 APA, all rights reserved)",Adolescent/young adult literature; Affective influences; Aliteracy; art; assessment; Choice; classrooms; Cognitive; Constructivism; Content analyses; Criterion referenced; Depth of (higher level; Developmental; Digital Media; Digital/media literacies; Early adolescence; Elementary School Students; etc.); Evidence‐based; Experimental; Field work; fluency; Information literacy; informational text; Instructional models; Instructional strategies; Interest; Intrinsic; literal level; Making inferences; Middle Schools; Nonfiction; Outcomes; Persistence; preference; quasi‐experimental; reading comprehension; Reading strategies; Scaffolding; Schema theory; Scientific; Self‐efficacy; Specific subject areas (math; Structural analysis; Summarizing; Teaching Methods; teaching strategies; Text features; Text Structure; Text types; Thematic units; Theoretical perspectives,"Guthrie, John T.; Klauda, Susan Lutz",2014.0,10.1002/rrq.81,1,100
