key,title,abstract,keywords,authors,year,url,Included,ID
172,The effect of self-explanation and strategy training on l2 reading comprehension using an intelligent tutoring system,"While research suggests that secondary language (L2) learners at postsecondary institutions face academic reading challenges, and that reading strategy training can improve primary language (L1) learners' reading comprehension, it remains a challenge to find scalable ways to deliver such training to L2 learners. Intelligent tutoring systems (ITS) have been shown to be nearly as effective as human tutors while reaching potentially unlimited numbers of learners in a variety of subjects, including reading comprehension. However, few studies have explored the effectiveness of such systems for improving L2 learners' reading comprehension. Self-Explanation Reading Training (SERT) is an instructional model that combines self-explanation and five reading strategies (monitoring, paraphrasing, prediction, elaboration, and bridging), and has been shown to be effective. SERT has also been built into a game-based intelligent tutoring system environment called Interactive Strategy Trainer for Active Reading and Thinking —Motivationally Enhanced (iSTART-ME). Studies have demonstrated the effects of iSTART-ME in improving L1 students' reading comprehension and learning motivation, but little evidence exists for its efficacy for L2 learners. This research tested the reading strategy training effect through iSTART-ME on 34 incoming international L2 students admitted to a large public American higher institution in the Southwest. In addition to pretests, presurveys, posttests, and postsurveys, these students received three hours training within two consecutive days right before their fall semester school courses formally started. The results showed that their self-explanation quality scores, short-answer reading comprehension test scores, and learning motivation scores were significantly improved with a medium effect size. The results also suggested that students with lower self-explanation and comprehension ability benefited the most, although all students benefitted from the training. After the training, the interviewees reported that their learning with iSTART-ME was interesting and successful, expressed a desire to learn more strategies with iSTART-ME in the future, and expected to apply the strategies they learned to other subjects. This study implied that iSTART-ME, with low cost in reaching large numbers of students, effectively taught the incoming international college students reading strategies, and improved their L2 reading comprehension abilities and learning motivations. (PsycINFO Database Record (c) 2016 APA, all rights reserved)",intelligent tutoring; Intelligent tutoring systems; learning motivation; motivation; Reading; reading comprehension; Reading strategies; Training; Tutoring,"Fu, Hongxia",2015.0,,0,172
173,The Effects of Reading Strategy Instruction via Electronic Storybooks on EFL Young Readers' Reading Performance,"The prevalence of web-based applications and the use of multimedia in school make learning and teaching through the Internet a popular method in education (Ferdig, 2005). To keep in line with the trend, the purpose of the study was to explore the effects of reading strategy instruction via electronic storybooks on EFL elementary school students' reading comprehension, their strategy use and their viewpoints toward electronic storybooks-based reading strategy instruction. Fifty-seven Taiwanese EFL fourth graders from two intact classes were chosen, and assigned as an experimental group and a control group. The experimental group received a ten-week reading strategy instruction whereas the control group did not engage in any strategy training. The experimental group were taught seven reading strategies, which were practiced in small groups. The instruments 1d one STYLE proficiency test, five reading comprehension tests, and questionnaires of strategy use and an attitude questionnaire toward e-books based reading strategy instruction. Results indicated that after reading strategy instruction, the experimental group performed better than the control group in story comprehension, but without significance. However, they significantly outperformed the control group in strategy use. Also, the experimental group had positive attitude toward e-books based reading strategy instruction. Pedagogical implications were provided.",Childrens Literature; Control Groups; educational technology; Electronic Publishing; Elementary School Students; English (Second Language); English language learners; Experimental Groups; Foreign Countries; Grade 4; Likert Scales; Quasiexperimental Design; Questionnaires; reading comprehension; reading instruction; Reading strategies; Reading Tests; Taiwan; Teaching Methods; Technology Uses in Education,"Fu, Yu-Ju; Chen, Shu-Hui; Wey, Shyh-Chyi; Chen, Shu-Chu",2014.0,,0,173
174,Reading strategies of good and poor readers of German with different spelling abilities,"Reading and spelling abilities are thought to be highly correlated during development, and orthographic knowledge is assumed to underpin both literacy skills. Interestingly, recent studies showed that reading and spelling skills can also dissociate. The current study investigated whether spelling skills (indicating orthographic knowledge) are associated with the application of orthographic strategies during reading. We examined eye movements of 137 third- and fourth-graders who were either good or poor readers with or without a spelling deficit: 43 children with typical reading and spelling skills, 28 with isolated spelling deficits, 28 with isolated reading deficits, and 38 with combined reading and spelling deficits. Although we expected to find reduced reliance on orthographic reading processes among poor spellers, this was evident for the group with combined deficits only. Both isolated deficit groups applied sublexical and lexical processes in a similar amount to typically developing children. Our findings suggest that reading rests on orthographic strategies even if lexical representations are poor as indicated by a deficit in spelling skills. Findings also show that dysfluent reading does not result only from overreliance on decoding. (PsycINFO Database Record (c) 2019 APA, all rights reserved)",Childhood Development; Cognitive Style; Consistent orthography; (Dys)fluent readers; Eye Movements; Learning Strategies; Orthographic knowledge; Orthography; Reading Ability; reading development; Reading strategies; Spelling; Test Construction; Verbal Fluency; Visual Tracking,"Gangl, Melanie; Moll, Kristina; Banfi, Chiara; Huber, Stefan; Schulte-Körne, Gerd; Landerl, Karin",2018.0,10.1016/j.jecp.2018.05.012,0,174
175,Acquisition of Language and Intercultural Competences in Tourism and Hospitality Studies through Active Experimentation in Second Life,"Living in a global world involves not only mastering languages, but also dealing with different habits and values. It becomes critical with students trained to deal with a multicultural public, such as the group of learners from tourism covered by our research. Our proposal aims to analyze whether the virtual world of Second Life (SL) facilitates the development of English for Specific Purposes and the acquisition of intercultural communication. To cover the objective qualitative and quantitative research were conducted along a four-phased in/out SL instruction. Questioning about the differences between the mean score obtained by experimental and control groups shows no significant differences in the acquisition of language regarding face to face and Second Life interaction, but demonstrates a positive tendency in the case of intercultural competences.",computer games; Computer Simulation; Control Groups; English for Special Purposes; Experimental Groups; Foreign Countries; Hospitality Occupations; Hypothesis Testing; Interaction; Intercultural Communication; Mixed Methods Research; Second Language Instruction; Second Language Learning; Simulated Environment; Spain; Teaching Methods; Tourism; Undergraduate Students,"García, Mercedes Rico; Da Silva, Paula Ferreira",2018.0,,0,175
176,Effects of Multimedia Annotations on Thai EFL Readers' Words and Text Recall,"This study aimed to investigate the effects of using multimedia annotations on EFL readers' word recall and text recall and to explore which type of multimedia annotations--L1 meaning, L2 meaning, sound, and image--would have a better effect on their recall of new words and text comprehension. The participants were 78 students who enrolled in an Intermediate EFL course at a university in the north of Thailand. Five instruments--a questionnaire, a vocabulary pre-test, a computerized log-file, and two posttests: a vocabulary test and a text recall test--were used to collect data. First, the participants responded to the questionnaire and the pre-test in the classroom. One week later, they read a hypertext equipped with multimedia annotations in the computer laboratory while the log files recorded their selections of words and annotations. Immediately after that, they answered the two post-tests. Three weeks later, a vocabulary test was given to the participants again without informing in advanced. The results revealed that (1) accessing multimedia annotations led to significantly greater vocabulary recall (42%) among Thai EFL learners; (2) their retention lasted at least three weeks after being exposed to the multimedia-annotated text; (3) they recalled words with images significantly better than those with no images; (4) they recalled about 31% of the text with multimedia annotations; and (5) no significant difference was found regarding the effects of using different types of multimedia annotations on learners' word recall and text recall when compared between learners.",College Students; Documentation; English (Second Language); Flesch Kincaid Grade Level Formula; Foreign Countries; Hypermedia; Multimedia Instruction; Pretests Posttests; Questionnaires; reading comprehension; Recall (Psychology); Retention (Psychology); Second Language Instruction; Statistical Analysis; Technology Uses in Education; Thailand; Vocabulary Development,"Gasigijtamrong, Jenjit",2013.0,,0,176
177,"The effects of a computer assisted reading program on the oral reading fluency and comprehension of at-risk, urban first grade students","The current investigation studied the effects of a computer software program of the oral reading fluency and comprehension of eight, first grade students. These students were identified as being either 'at-risk' or 'some-risk' for reading failure on the DIBELS oral reading fluency winter benchmark assessment. A multiple probe design was used to determine if the Read Naturally software edition would increase the ORF, as measure as correct words per minute, on treatment and generalization probes. Also measured were the percentage of comprehension questions answered correctly on treatment probes and word retell on both treatment and generalization probes. The Read Naturally software edition consisted of a repeated reading sequence activity that the participants engaged in on a laptop computer. The sequence consisted of seven components: key words, one-minute cold reading, read along, practice reading, comprehension quiz, and pass timing. Treatment sessions lasted approximately thirty minutes and were conducted three to four times per week, for between 14 and 16 weeks. Pretest and posttest measure were collected to determine if the participants' scores on these test would increase following the completion of the intervention. The results of the intervention demonstrated the effectiveness of the Read Naturally program on the OFR and comprehension of the participants on treatment probes. All of the participants were able to increase their scores on these measures over baseline levels; however, the results were not as evident for generalization probes. Many of the participants were not able to increase their ORF on generalization probes to benchmark levels. Due to this failure to increase reading fluency a second treatment phase was implemented with increase fluency requirements. During this second phase 5 out of 8 participants were able to increase their ORF to benchmark levels on generalization passages. Additionally, 5 out of 8 participants were able to decrease their DIBELS ORF risk status on winter benchmark assessments. These finding support research on the use of repeated reading strategies, but extend the research in several ways. First, the results suggest the computer assisted reading programs are a viable means to supplement classroom instruction. Second, they suggest that generalization might be promoted by increasing fluency goal criteria on practice passage reading. Finally, the results suggest that repeated reading strategies can be used successful with first grade students. Implications for classroom use, limitations, and directions for future research are presented. (PsycINFO Database Record (c) 2016 APA, all rights reserved)",at risk populations; at-risk populations; comprehension; Computer Assisted Instruction; computer assisted reading program; computer software; Grade Level; Oral Reading; oral reading fluency; Reading; Reading Education; students; Urban Environments; urban first grade students; Verbal Fluency,"Gibson, Lenwood",2010.0,,0,177
178,The Effects of a Supplementary Computerized Fluency Intervention on the Generalization of the Oral Reading Fluency and Comprehension of First-Grade Students,"The current study investigated the effects of a repeated reading intervention on the oral reading fluency (ORF) and comprehension on generalization passages for eight, first-grade students with reading risk. The intervention involved a commercial computerized program (Read Naturally Software Edition [RNSE], 2009) and a generalization principle requiring a ""greater magnitude"" of responding. A multiple probe experimental design with two treatment phases was used to determine the effects of the intervention. Phase I used a standard end-of-year benchmark score (i.e., 40 CWMP) as fluency criteria for all participants. During Phase II, fluency criteria were changed and individualized for each participant based on performance during Phase I. Data were collected on ORF and word retell fluency (WRF) across treatment and generalization probes. Results showed ORF and comprehension increases in both phases; however, satisfactory generalization did not occur for most of the participants until the second phase was implemented. These results are discussed relative to classroom implications and directions for future research.",At Risk Students; Benchmarking; Computer Assisted Instruction; Dynamic Indicators of Basic Early Literacy Skills (DIBELS); Elementary School Students; Generalization; Grade 1; intervention; Oral Reading; reading comprehension; Reading Fluency; Reading Improvement; reading instruction; Reading strategies; Reading Tests; Scores; Supplementary Education,"Gibson, Lenwood, Jr.; Cartledge, Gwendolyn; Keyes, Starr E.; Yawn, Christopher D.",2014.0,,0,178
179,Contemporary Spheres for the Teaching Education: Freire's Principles,"Freire's cogitation on Information Technology (IT), resources for education have been known since the decade of the 50s. And now, within the current context, this analysis outlines the literacy problem as an issue of gnosis and anthropology while existing in a virtual dimension. Based on research/experiences that also were carried out in Brazil, it can be noted that the literacy that is being discussed 1s the skill in handling a mouse, selecting, dragging, cutting, pasting, CTRL C+CTRL V, writing a text and searching the internet, but although it seems ""obvious"", public education policy has not given sufficient thought nor assumed a pedagogical position on these issues. This discussed cogitation considers contributions of the Freire pedagogy, in the attempt to attain, through this type of literacy, the unprecedented accomplishment of something viable-that what teachers realize as unprecedented, due to the fact that nobody has accomplished it before, however viable, because all of the conditions to make it happen are there, including a critical preparation of the educators. Within the internet context, the proposal implies a digital writing and reading ability that is based on communication and dialogue skills and, as fundamental strategies for reading the world, the real/virtual world, the knowledge of the daily speech, of writing and reading within a multi-diversification of digitally generated texts. A bibliography of resources is also 1d.",Anthropology; Brazil; Foreign Countries; information technology; Internet; Public Education; Reading Ability,"Gomez, Margarita Victoria",2006.0,,0,179
180,Digital versus paper reading processes and links to comprehension for middle school students,"This study explores digital and paper reading processes and outcomes for 371 fifth to eighth graders completing a reading task similar to standardized testing. Results showed students highlighted and annotated more when reading the paper versus digital text. Also, reading on paper versus digitally was slightly supportive of reading comprehension for the longer section of text. For behaviors, digital highlighting and looking back at the paper text were supportive of reading comprehension, whereas paper highlighting was negatively related, likely because paper highlighting tended to occur often outside of important areas of the text. Paper and digital annotating, online dictionary use, and digital look-back did not link to comprehension, when controlling for other covariates. Links to theory, research, and practice are discussed. (PsycInfo Database Record (c) 2021 APA, all rights reserved)",comprehension; digital reading; Digital Technology; highlighting; Middle School Students; Reading; reading behaviors; reading comprehension; Standardized Tests; students,"Goodwin, Amanda P.; Cho, Sun-Joo; Reynolds, Dan; Brady, Katherine; Salas, Jorge",2020.0,10.3102/0002831219890300,0,180
181,"Glossing for meaning and glossing for form A computerized study of the effects of glossing and type of linguistic item on reading comprehension, noticing, and L2 learning","The relative effectiveness of annotating L2 texts for improved comprehension has been generally supported by studies on glossing. The assumption has been that glosses are effective decoding devices that help L2 readers overcome their limited proficiency by making meanings more accessible to them. At the same time, glosses have been investigated in relation to noticing and learning in incidental contexts. In spite of its centrality, this question has not generally been addressed empirically in previous studies on glossing and L2 learning because qualitative measures of L2 processing, and concurrent data elicited via those measures, were generally not available in these studies. The present study addresses this important methodological problem in the glossing strand of research by utilizing a pretest-posttest-delayed posttest hybrid design that incorporates a combination of outcome and processing measures to investigate the issue of L1-translation glosses and type of linguistic item in relation to reading comprehension, noticing and learning. First-year college students learning Spanish were asked to read one of two versions of an L2 Spanish text on a computer. In the glossed version, exemplars of three types of linguistic items embedded in the text were glossed with L1 English translations presented at the bottom of page. In the no-gloss conditions, participants were exposed to a different version of the same text without glosses. After exposure to the L2 reading task, participants completed a multiple-choice comprehension questionnaire previously announced to them, and two unannounced production and recognition immediate posttests, which were repeated three weeks later. The results of the study indicate that the presence of a gloss has a positive effect on a reading comprehension. However, the quantitative and qualitative evidence of the study does not support an effect of glosses on noticing and L2 learning of targeted items. Rather, the study provides evidence that glosses work in combination with other variables to impact different types of items differentially. Combined effects of glossing and type of linguistic item found in the study strongly suggest that glosses do not work in isolation but in combination with other factors to affect noticing and learning. (PsycINFO Database Record (c) 2016 APA, all rights reserved)",comprehension; glossing; Learning; linguistic item; Linguistics; meaning; Reading; reading comprehension,"Guidi, Claudia",2009.0,,0,181
182,The effects of low-vision rehabilitation on reading speed and depression in age related macular degeneration: A meta-analysis,"Importance: Age related macular degeneration (AMD) is a progressive eye disease that, as of 2015, has affected 11 million people in the U.S. and 1.5 million in Canada causing central vision blindness. By 2050, this number is expected to double to 22 million. Eccentric vision is the target of low-vision rehabilitation aids and programs for patients with AMD, which are thought to improve functional performance by improving reading speed and depression. Objective: This study evaluates the effect of various low-vision rehabilitation strategies on reading speed and depression in patients 55 and older with AMD. Data Sources: Computer databases including MEDLINE (OVID), EMBASE (OVID), BIOSIS Previews (Thomson-Reuters), CINAHL (EBSCO), Health Economic Evaluations Database (HEED), ISI Web of Science (Thomson-Reuters) and the Cochrane Library (Wiley) were searched from the year 2000 to January 2015. Study Selection: 1d papers were research studies with a sample size of 20 eyes or greater focused on AMD in adults aged 55 or older with low vision (20/60 or lower). Data Extraction and Synthesis: Two independent reviewers screened and extracted relevant data from the 1d articles. Standardized mean difference (SMD) was chosen as an effect size to perform metaanalysis using STATA. Fixed- and random-effect models were developed based on heterogeneity. Main Outcomes: Reading Speed and Depression Scores. Results: A total of 9 studies (885 subjects) were 1d. Overall, a significant improvement in reading speed was found with a SMD of 1.01 [95% CI: 0.05 to 1.97]. Low-vision rehabilitation strategies including micro-perimetric biofeedback, microscopes teaching program significantly improved reading speed. Eccentric viewing training showed the maximum improvement in reading speed. In addition, a non-significant improvement in depression scores was found with a SMD of -0.44 [95% CI: -0.96 to 0.09]. Conclusion: A considerable amount of research is required in the area of low-vision rehabilitation strategies for patients with AMD. Based on current research, low-vision rehabilitation aids improve reading speed. However, they do not have a significant effect on depression scores in those 55 and older with AMD. (PsycInfo Database Record (c) 2020 APA, all rights reserved)",Aged; Depression; Humans; macular degeneration; Reading; treatment; vision disorders,"Hamade, Noura; Hodge, William G.; Rakibuz-Zaman, Muhammad; Malvankar-Mehta, Monali S.",2016.0,10.1371/journal.pone.0159254,0,182
