key,title,abstract,keywords,authors,year,url,Included,ID
263,How Does the Use of Blogs Impact Student Motivation for Literature Discussions?,"This study sought to determine the impact of blogs on student motivation to discuss literature. The participants were 11 male and 12 female fourth grade students ranging from eight to ten years of age. All of the students were instructed in one classroom located in a suburban school setting. All students had access to computers fitted with high speed Internet in their classroom. Most of the students had access to the Internet at home as well. Semi-structured interviews and survey instruments were administered over a six-week period. The response data were analyzed to ascertain the strengths and weaknesses of the students as well as to make suggestions for improvement with reference to the use of blogs. Data analysis revealed gender and reading ability did not impact preferences significantly, and there was generally an equal split between preferences for blogs and face-to-face discussion of literature. A major factor in student preference was the ease with which the blog approach was perceived. Ease interacted with time limitations, technological ability, individual and group dynamics, and beliefs towards publication to a worldwide audience. It was concluded that blogs, while not solely motivating, can impact student motivation toward discussion.",Computer Mediated Communication; data analysis; Discussion Groups; Electronic Journals; Elementary School Students; gender differences; Grade 4; Literature Appreciation; Outcomes of Education; Preferences; Pretests Posttests; Reading Ability; Reading strategies; Semi Structured Interviews; Student Journals; Student Motivation; Student Surveys; Suburban Schools; Usability,"Pane, Pamela",2014.0,,0,263
264,Reading instruction in a technological age,"This chapter explores how digital media can be integrated into L2 reading instruction to help learners improve their reaching skills. Drawing on literature that outlines principles of L2 reading instruction, this chapter focuses on technological tools that can be used in activating background knowledge, enriching vocabulary, teaching for comprehension, improving reading fluency, and promoting extensive reading. Some of these tools are specifically geared to provide reading support, such as hypermedia annotation, text-to-speech, and text reformatting others are more general, such as Internet resources, wilds, and blogs. We discuss findings from empirical studies that examine how effectivity these tools facilitate cognitive processes integral to L2 reading, thereby assisting reading skills development Limitations surrounding these studies are also addressed. We conclude by summarizing pedagogical implications for L2 instructors and offering suggestions to researchers who study the use of technologies in L2 reading. (PsycINFO Database Record (c) 2017 APA, all rights reserved)",comprehension; Reading Ability; reading instruction; technological age; technology,"Park, Youngmin; Warschauer, Mark",2016.0,,0,264
265,The Impact of Collaborative Online Reading on Summarizing Skills,"The aim of this study was to determine whether, as a result of collaborative-online reading of a chapter from a book of an academic nature, the quality of the collaborative summary that the readers would write would be higher than that written by readers who would both read the same chapter and write a summary in a face-to-face setting. In this study we examined the difference between the summaries written by participants from two groups, each group was divided into subgroups of 3 participants who had read collaboratively a chapter of a book, and collaborated on writing a summary. The participants of the experimental group read the chapter as it appeared in a website for collaborative reading built especially for this study and the participants were asked to summarize the chapter on a shared online digital document. The participants of the control group were asked to read the chapter face-to-face and to collaboratively summarize it in hand writing. The quality of the summaries was evaluated with a tool developed by Rivard (2001). This tool was developed to measure the quality of the summaries. In our study the main and secondary ideas that were supposed to be 1d in the participants' summaries were identified by three literature teachers using ten different criteria and the summaries were analyzed by two other judges based on these criteria. The findings indicated that there were significant differences in the majority of the writing indicators being measured with the tool. The findings indicated that collaborative-online reading and writing produce a summary of a higher quality than one read and hand written collaboratively face-to-face.",Control Groups; Conventional Instruction; Cooperation; Cooperative Learning; Documentation; Electronic Publishing; Experimental Groups; instructional effectiveness; Reading Assignments; Writing Skills,"Passig, David; Maidel-Kravetsky, Jenny",2016.0,,0,265
266,Developing Summarizing Skills in 4th Grade Students: Intervention Programme Effects,"The aim of our study was to determine whether summarizing skills could be developed in 4th grade primary school students. We designed a 5-month intervention programme as an experimental study, in which teachers trained students in the experimental group in their ability to summarize, which is one of the important strategies that enhance reading comprehension. 190 students in 4th grade from 8 primary schools in Slovenia participated in the study. We evaluated students' general reading competency, their metacognitive knowledge about reading and their ability to make summaries of two short and one longer expository text (pretest, posttest and follow-up test). The general reading competency explained the most variance in summarizing at pretest and posttest by experimental and control group of students. In the follow-up test, the summarizing from posttest was the strongest predictor in both groups and in the experimental group also the metacognitive knowledge about reading. The results showed that teachers can develop summarizing skills in students by systematically training them to use these skills, but the training effects decrease if the learning environment does not encourage students to use these skills.",Control Groups; Elementary School Students; elementary schools; Foreign Countries; Grade 4; intervention; Metacognition; Predictor Variables; Pretests Posttests; reading comprehension; Reading Fluency; reading instruction; Reading Tests; Slovenia; Vocabulary,"Pecjak, Sonja; Pirc, Tina",2018.0,,0,266
267,Evaluating an Intelligent Tutoring System for Making Legal Arguments with Hypotheticals,"Argumentation is a process that occurs often in ill-defined domains and that helps deal with the ill-definedness. Typically a notion of ""correctness"" for an argument in an ill-defined domain is impossible to define or verify formally because the underlying concepts are open-textured and the quality of the argument may be subject to discussion or even expert disagreement. Previous research has highlighted the advantages of graphical representations for learning argumentation skills. A number of intelligent tutoring systems have been built that support students in rendering arguments graphically, as they learn argumentation skills. The relative instructional benefits of graphical argument representations have not been reliably shown, however. In this paper we present a formative evaluation of LARGO (Legal ARgument Graph Observer), a system that enables law students graphically to represent examples of legal interpretation with hypotheticals they observe while reading texts of U.S. Supreme Court oral arguments. We hypothesized that, compared to a text-based alternative, LARGO's diagramming language geared toward depicting hypothetical reasoning processes, coupled with non-directive feedback, helps students better extract the important information from argument transcripts and better learn argumentation skills. A first pilot study, conducted with volunteer first-semester law students, provided support for the hypothesis. The system especially helped lower-aptitude students learn argumentation skills, and LARGO improved the reading skills of students as they studied expert arguments. A second study with LARGO was conducted as a mandatory part of a first-semester University law course. Although there were no differences in the learning outcomes of the two conditions, the second study showed some evidence that those students who engaged more with the argument diagrams through the advice did better than the text condition. One lesson learned from these two studies is that graphical representations in intelligent tutoring systems for the ill-defined domain of argumentation may still be better than text, but that engagement is essential. (Contains 8 tables and 7 figures.)",Discovery Learning; Feedback (Response); Formative Evaluation; Information Retrieval; Intelligent tutoring systems; Law Students; Learner Engagement; Notetaking; Persuasive Discourse; problem solving; Student Motivation; Visual Aids,"Pinkwart, Niels; Ashley, Kevin; Lynch, Collin; Aleven, Vincent",2009.0,,0,267
268,Contrasting group analysis of Brazilian students with dyslexia and good readers using the computerized reading and writing assessment battery 'BALE',"The analysis of cognitive processes underpinning reading and writing skills may help to distinguish different reading ability profiles. The present study used a Brazilian reading and writing battery to compare performance of students with dyslexia with two individually matched control groups: one contrasting on reading competence but not age and the other group contrasting on age but not reading competence. Participants were 28 individuals with dyslexia (19 boys) with a mean age of 9.82 (SD ± 1.44) drawn from public and private schools. These were matched to: (1) an age control group (AC) of 26 good readers with a mean age of 9.77 (SD ± 1.44) matched by age, sex, years of schooling, and type of school; (2) reading control group (RC) of 28 younger controls with a mean age of 7.82 (SD ± 1.06) matched by sex, type of school, and reading level. All groups were tested on four tasks from the Brazilian Reading and Writing Assessment battery ('BALE'):Written Sentence Comprehension Test (WSCT); Spoken Sentence Comprehension Test (OSCT); Picture- Print Writing Test (PPWT 1.1-Writing); and the Reading Competence Test (RCT). These tasks evaluate reading and listening comprehension for sentences, spelling, and reading isolated words and pseudowords (non-words). The dyslexia group scored lower and took longer to complete tasks than the AC group. Compared with the RC group, there were no differences in total scores on reading or oral comprehension tasks. However, dyslexics presented slower reading speeds, longer completion times, and lower scores on spelling tasks, even compared with younger controls. Analysis of types of errors on word and pseudoword reading items showed students with dyslexia scoring lower for pseudoword reading than the other two groups.These findings suggest that the dyslexics overall scores were similar to those of younger readers. However, specific phonological and visual decoding deficits showed that the two groups differ in terms of underpinning reading strategies. (PsycInfo Database Record (c) 2020 APA, all rights reserved)",Academic Achievement; assessment; Cognitive Processes; Dyslexia; Educational Measurement; phonological processing; Reading Ability; Reading Skills; visual coding; Writing Skills,"Piza, Carolina M. J. Toledo; Macedo, Elizeu C.; Miranda, Monica C.; Bueno, Orlando F. A.",2014.0,,0,268
269,Deriving Empirically-Based Design Guidelines for Advanced Learning Technologies that Foster Disciplinary Comprehension,"Planning, conducting, and reporting leading-edge research requires professionals who are capable of highly skilled reading. This study reports the development of an empirically informed computer-based learning environment designed to foster the acquisition of reading comprehension strategies that mediate expertise in the social sciences. Empirical data were gathered in a mixed-methods explanatory sequential design that examined the reading comprehension strategies used by an expert social scientist while reading a professional-level text. Process data were collected through a concurrent think-aloud protocol and coded according to reading comprehension processes. We combined both quantitative and qualitative analyses to identify, describe, and explain patterns in the expert's use of reading strategies. Our findings indicate that highly-skilled reading is characterized by critiquing text information, relating information to prior knowledge, and evaluating one's own understanding of text information. Findings are used to inform the design of worked-examples and a pedagogical agent embedded within the Highly-Skilled Reading Tutor. (Contains 4 tables, 2 footnotes and 3 figures.)",Canada; Case Studies; Coding; College Faculty; Computer System Design; Demonstrations (Educational); Design Requirements; Educational Experiments; Expertise; Foreign Countries; Instructional Design; Intelligent tutoring systems; Journal Articles; Mixed Methods Research; Novices; Prior Learning; Protocol Analysis; reading comprehension; reading instruction; Reading Research; Reading Skills; Reading strategies; Skill Development; Social Science Research; Social Sciences; Social Scientists; Statistical Analysis,"Poitras, Eric; Trevors, Gregory",2012.0,,0,269
270,Instructional Effectiveness of a Computer-Supported Program for Teaching Reading Comprehension Strategies,"This article examines the effectiveness of a computer-based instructional program (e-PELS) aimed at direct instruction in a collection of reading comprehension strategies. In e-PELS, students learn to highlight and outline expository passages based on various types of text structures (such as comparison or cause-and-effect) as well as to paraphrase, self-question, and summarize. The study involved 1041 fourth-grade elementary students from 21 schools distributed in three regions in central Chile. Participant teachers integrated this program into the Spanish language curriculum, instructing their students during thirty sessions of 90 min each during one school semester. Pretest-to-posttest gains in reading comprehension scores were significantly greater for students instructed with this program than for students who received traditional instruction (d = 0.5), with particularly strong effects for lower-achieving students (d = 0.7). The findings support the efficacy of direct instruction in specific learning strategies in a computer-based environment. (Contains 3 figures and 11 tables.)",Chile; Comparative Analysis; Computer Assisted Instruction; Conventional Instruction; Direct Instruction; educational technology; Expository Writing; Foreign Countries; Grade 4; instructional effectiveness; Language Arts; Learning Strategies; Pretests Posttests; reading comprehension; reading instruction; Reading strategies,"Ponce, Hector R.; Lopez, Mario J.; Mayer, Richard E.",2012.0,,0,270
271,Word reading skills of beginning non-readers: Effects of training with a visible orthography,"The experiments presented here investigated the effects of manipulating the visibility of spelling patterns in English print, without concurrent oral segmentation, on the word identification skills of beginning non-readers. Visibility of the orthographic patterns was manipulated by presenting material organized into rime families (blocked) or with rime families distributed throughout training (unblocked), as well as through highlighting common rimes in the same colour of print. Experiment 1 demonstrated that while a program emphasizing the orthographic patterns in the English writing system (without concurrent phonological segmentation) led to rapid improvements in beginning non-readers' online word identification, the benefits of such training did not persist beyond the training context. Experiments 2A and 2B investigated whether the failure to transfer word reading skills beyond the blocked training context was mitigated by training programs that required increased focus on the letter patterns (2A) and the letter-sound relations (2B). These manipulations did not influence performance; children continued to demonstrate poor transfer beyond the training context. Experiment 3 focused on determining the mechanisms underlying the poor transfer following blocked training. To evaluate performance, this final experiment used a novel measure comprising word identification as well as onset and rime identification. Training materials were blocked either by rimes or onsets. The question of interest was whether training on material that blocks by orthographic units allows children to identify the blocked units during training without actively decoding their letter-sound relations, thus decreasing the probability of forming connections between the graphemes and phonemes comprising them. Results indicated that this is the case when children were trained on material blocked by rimes, but not that blocked by onsets. (PsycINFO Database Record (c) 2016 APA, all rights reserved)",beginning non-readers; Orthography; Reading; Reading Skills; Spelling; Training; training effects; visible orthography; Vocabulary; word reading skills,"Poole, Heather Louise",2010.0,,0,271
272,Online Research Strategies of L2 Readers: Evaluating Strategic Competence through Mixed Methods,"Researching from multiple-documents online is an essential activity, but it has generally been overlooked by second language (L2) educators. This study uses navigation tracking, eye tracking, a post-reading recall task, and interviews to examine the degree to which Japanese L2 readers maintain task awareness when researching online. Key reading variables analyzed were attention to relevant versus irrelevant pages and repeated versus novel content. Finally, the experiment analyzed the connection between the reading measures and post-reading recall scores. The findings suggest that the readers displayed moderate competence overall, but some participants lacked strategic competence. There was a significant correlation between reading relevant content and recall performance. The research has several implications for L2 instructors.",attention; English (Second Language); Eye Movements; Foreign Countries; Japan; Journal Articles; Metacognition; Online Searching; Reading; Reading Skills; Reading strategies; Recall (Psychology); Search Strategies; Second Language Learning; Student Attitudes; Student Research; Time; Undergraduate Students,"Prichard, Caleb; Atkins, Andrew",2020.0,,0,272
273,The Relationship between Reading Strategy Use and Reading Comprehension as Mediated by Reading Rate: The Case of Eye Movement Training by Rapid Serial Visual Presentation (RSVP),The purpose of the current study was to examine the relationship between reading strategy use and reading comprehension as mediated by reading rate amongst advanced EFL students who received eye movement training by Rapid Visual Presentation (RSVP) technology. Seventy-two EFL learners participated in the study and received instruction for enhancing their reading speed via Reading Trainer Application for twelve consecutive weeks. Their entry-level of reading strategies awareness was assessed by the Metacognitive Awareness of Reading Strategies Inventory prior to and after the study. Their reading comprehension was assessed by International English System Test before and after the study. Their reading rate was also recorded prior to and after the study. Modelling the relationship between strategy use and reading comprehension as mediated by reading rate was tested prior to the study and the findings showed that the model was not statistically significant. The model was reassessed after the experiment and the results lent credence to the fact that eye training via RSVP for speed reading led to a mediating role for reading rate in the relationship between strategy use and reading comprehension. The results support the fact that reading rate is a contributory factor in understanding reading passages and integrating speed reading training using the-state-of-the-art technologies into reading instruction should be considered in EFL reading courses.,Computer Assisted Instruction; computer software; Correlation; English (Second Language); Eye Movements; Handheld Devices; instructional effectiveness; International English Language Testing System; Language Tests; Late Adolescents; Metacognition; reading comprehension; Reading Rate; Reading strategies; Second Language Learning; Telecommunications; Training Methods,"Rahimi, Mehrak; Babaei, Seyyed Abolfazl",2021.0,,0,273
274,Reading-metacognitive strategy awareness and use in reciprocal teaching settings: Implementing a computerized RMSA system,"The present experiment was composed of both qualitative and quantitative methods and aimed at investigating Reading Metacognitive Strategy Awareness (RMSA) and use by the aid of three inventory techniques including a questionnaire, a think-aloud protocol, and a Computerized RMSA System. The computerized system was specifically designed and validated to satisfy the needs of this study in measuring and practicing Reading Metacognitive Strategies. It also tried to explore any possible effects of Computerized RMSA System on reading comprehension of the participants. To this end, a sample of 25 university students majoring in English Translation and English Literature from a University in Iran were selected based on purposive and clustered sampling. The research data were selected using a number of instruments including the reading section of Test of English as a Foreign Language as pre/posttest, a researcher-made Reading Metacognitive Strategies questionnaire, think-aloud protocol and a Computerized RMSA System. The research findings show that the questionnaire, think-aloud and Computerized RMSA System results vary significantly. Moreover, Computerized RMSA System has a positive effect on reading comprehension of learners of English as a Foreign Language. Pedagogical implications of the findings are discussed. (PsycInfo Database Record (c) 2021 APA, all rights reserved)",Computer Assisted Instruction; computer assisted inventory; Metacognition; reading comprehension; reading metacognitive strategies; reciprocal teaching; Teaching Methods,"Reshadi-Gajan, Elnaz; Assadi, Nader; Davatgari Asl, Hanieh",2020.0,10.1177/0735633120937437,0,274
275,Investigating the Effect of Using Multiple Sensory Modes of Glossing Vocabulary Items in a Reading Text with Multimedia Annotations,"In recent years, improvements in technology have enhanced the possibilities of teaching and learning various subjects. This is specially the case in foreign language instruction. The use of technology and multimedia brings new opportunities for learning different areas of language. In this regard, the present study attempts to find out if the use of multimedia, images and movies, helps learners in learning vocabulary items 1d in a reading comprehension text. For this purpose, 70 students studying English at pre-intermediate level have been selected. These participants are then divided into three groups, each of which receives a different kind of instruction. The members of the first group were required to read some texts in which certain vocabulary items were 1d as the target of teaching. Those in the second group received the same texts with some pictures added so that the grasp of the unknown words would become facilitated. The students in the third group were exposed to the same material along with some movie strips. The strips were selected in a way to 1 the specific vocabulary items. The course duration was about 45 days. At the end of the course, all the students in the three aforementioned groups were sat for taking a vocabulary test. The test format was multiple-choice. The results of the ANOVA indicated that annotating reading comprehension passages with movie clips contributes to better learning and recall of vocabulary through reading texts.",Adult Students; Computer Assisted Instruction; English (Second Language); Films; Illustrations; Institutes (Training Programs); Language Tests; Multimedia Instruction; Multiple Choice Tests; Pretests Posttests; reading comprehension; Recall (Psychology); Scores; Second Language Instruction; Second Language Learning; Statistical Analysis; Student Attitudes; Test Format; Vocabulary Development,"Rezaee, Abbas Ali; Shoar, Neda Sharbaf",2011.0,,0,275
