Key,title,abstract,keywords,authors,year,doi,Included,ID
119,A multicenter trial of oxcarbazepine oral suspension monotherapy in children newly diagnosed with partial seizures: A clinical and cognitive evaluation,"Purpose: We conducted a prospective, multicenter, open label trial to evaluate the effectiveness of oxcarbazepine (OXC) oral suspension as monotherapy for children newly diagnosed with partial seizures. Methods: This trial included a two- to eight-week titration and stabilization period to achieve effective target doses and a 24-week maintenance phase. The primary outcome measure was the seizure-free rate over six months, while a secondary measure was the change in cognition and behavior from screening to the end of the maintenance phase. The effectiveness of OXC was compared in intellectually normal versus intellectually impaired children (intelligence quotient <70). Results: We enrolled 171 patients and analyzed 168 as the per-protocol (PP) group (3 patients had protocol violations). The mean age of the PP group was 8.4 ± 2.7 years. The maintenance dose of OXC was 24.9 ± 8.0 mg/kg/day. Of the 168 patients included in the efficacy analysis, 122 (72.6%) completed the study and 94 (56.0%) became seizure-free after the OXC treatment. Comparing the efficacy of OXC for intellectually normal and intellectually impaired patients, 79 (56.8%) of the 139 intellectually normal patients and 15 (51.7%) of the 29 intellectually impaired patients became seizure-free (P = 0.61). After treatment, intelligence scale scores improved in intellectually normal patients compared to the intellectually impaired children (P < 0.05). Social problems quantified by behavior scales improved in intellectually impaired patients compared to intellectually normal children (P < 0.05). Conclusions: OXC is effective and well-tolerated as monotherapy in children with partial seizures. There was no difference in the effectiveness of OXC between intellectually normal and intellectually impaired children. © 2012 British Epilepsy Association. Published by Elsevier Ltd. All rights reserved.",Behavior; Child; Cognition; Epilepsy; Oxcarbazepine,"Eun, So Hee; Kim, Heung Dong; Chung, Hee Jung; Kang, Hoon Chul; Lee, Joon Soo; Kim, Joon Sik; You, Su Jeong; Moon, Han Ku; Lee, Young Mock; Kim, Dong Wook; Suh, Eun Sook; Kim, Ji Yeon; Lee, Juneyoung; Eun, Baik Lin",2012,10.1016/j.seizure.2012.07.007,0,112
120,Systematic review of educational interventions for looked-after children and young people: Recommendations for intervention development and evaluation,"Looked-after children and young people (LACYP) are educationally disadvantaged compared to the general population. A systematic review was conducted of randomised controlled trials evaluating interventions aimed at LACYP aged ≤18 years. Restrictions were not placed on delivery setting or delivery agent. Intervention outcomes were: academic skills; academic achievement and grade completion; special education status; homework completion; school attendance, suspension, and drop-out; number of school placements; teacher-student relationships; school behaviour; and academic attitudes. Fifteen studies reporting on 12 interventions met the inclusion criteria. Nine interventions demonstrated tentative impacts. However, evidence of effectiveness could not be ascertained due to variable methodological quality, as appraised by the Cochrane risk of bias tool. Theoretical and methodological recommendations are provided to enhance the development and evaluation of educational interventions.",foster care; group home; intervention; systematic review,"Evans, Rhiannon; Brown, Rachel; Rees, Gwyther; Smith, Philip",2017,10.1002/berj.3252,0,113
121,A retrospective comparison of mortality in critically ill hospitalized patients undergoing echocardiography with and without an ultrasound contrast agent,"Objectives: To compare acute mortality in critically ill hospitalized patients undergoing echocardiography with and without an ultrasound contrast agent (UCA). Background: Because of serious cardiopulmonary reactions reported immediately after administration of perflutren-containing UCAs, the FDA required a black box safety warning for this class of agents, including perflutren protein-type A microspheres injectable suspension. Methods: This study used the largest hospital service-level database in the U.S. All adult patients undergoing in-patient echocardiography between January 2003 and October 2005 were identified (n = 2,588,722, of which 22,499 received perflutren protein-type A microspheres injectable suspension). Of the 22,499 contrast echocardiography patients, 2,900 had diagnoses meeting criteria for critical illness (heart failure, acute myocardial infarction, arrhythmia, respiratory failure, pulmonary embolism, emphysema, and pulmonary hypertension). To control for the differences between the contrast and noncontrast patients, we used propensity score matching. Variables used in the construction of the propensity score included comorbidities, demographic factors, hospital-specific factors, level of care, and mechanical ventilation status. Patients receiving contrast echocardiography were matched to 4 control patients who received noncontrast echocardiography. Conditional logistic regression was used to estimate mortality effects. Results: There were 167 deaths in the study among critically ill patients, 38 of 2,900 from the contrast group and 129 of 11,600 from the control group. The contrast agent was not associated with an increase in same-day mortality (odds ratio: 1.18; 95% confidence interval: 0.82 to 1.71; p = 0.37). Before matching, contrast patients showed greater morbidity than noncontrast patients (Deyo-Charlson comorbidity score 2.45 vs. 2.25, p < 0.0001). After propensity score matching, these differences were significantly reduced, showing that both groups were well balanced. Conclusions: There is no increase in mortality in critically ill patients undergoing echocardiography with the UCA compared with case-matched control patients. © 2010 American College of Cardiology Foundation.",black box warning; Food and Drug Administration; Optison; ultrasound contrast agent,"Exuzides, Alex; Main, Michael L.; Colby, Chris; Grayburn, Paul A.; Feinstein, Steven B.; Goldman, Jonathan H.",2010,10.1016/j.jcmg.2010.04.006,0,114
122,Incidence of and Risk Factors for Severe Adverse Events in Elderly Patients Taking Angiotensin-Converting Enzyme Inhibitors or Angiotensin II Receptor Blockers after an Acute Myocardial Infarction,"Study Objective: To assess the incidence of and risk factors associated with severe adverse events in elderly patients who used angiotensin-converting enzyme inhibitors (ACEIs) or angiotensin II receptor blockers (ARBs) after an acute myocardial infarction (AMI). Design: Retrospective cohort study. Data Sources: Centers for Medicare & Medicaid Services Chronic Conditions Data Warehouse (Medicare service claims database), American Community Survey of the U.S. Census Bureau, and Multum Lexicon Drug database. Patients: A total of 101,588 eligible Medicare fee-for-service beneficiaries 66 years or older, who were hospitalized for AMI between January 1, 2008, and December 31, 2009, and used ACEIs or ARBs within 30 days after discharge. Measurements and Main Results: Primary outcomes were hospitalizations for acute renal failure (ARF) and hyperkalemia. The secondary outcome was discontinuation or suspension of ACEI/ARB therapy after a visit to a health care provider. The primary risk factors of interest were age, sex, race/ethnicity, and chronic kidney disease (CKD). Cumulative incidence curves and multivariable Fine-Gray proportional hazards models with 95% confidence intervals (CIs) were used with death as a competing risk in both intention-to-treat (ITT) and as-treated (AT) analyses. In the study cohort, 2.8% experienced ARF, 0.5% experienced hyperkalemia, and 63.7% discontinued ACEI/ARB therapy within 1 year after hospital discharge. Approximately half of the incidence of ARF and hyperkalemia occurred within 6 months after hospital discharge, but the cumulative incidence increased after 6 months. Patients older than 85 years had a higher rate of ARF (ITT hazard ratio [HR] 1.15, 95% CI 1.04–1.28) and hyperkalemia (ITT HR 1.33, 95% CI 1.05–1.68) compared with those aged 65–74 years. Patients with baseline CKD had higher rates of ARF (ITT HR 1.61, 95% CI 1.42–1.82), hyperkalemia (ITT HR 1.41, 95% CI 1.11–1.77), and ACEI/ARB therapy discontinuation or suspension (ITT HR 1.05, 95% CI 1.02–1.09). Conclusion: We found a low incidence of ARF and hyperkalemia in elderly patients treated with ACEIs or ARBs after AMI hospitalization. However, a high rate of treatment discontinuation might prevent a higher rate of occurrence of these events. Long-term careful monitoring of severe adverse events and timely discontinuation of ACEIs or ARBs among elderly patients with advancing age and CKD after an AMI is warranted in clinical practice.",acute kidney injury; acute renal failure; angiotensin II receptor blocker; angiotensin-converting enzyme inhibitor; elderly; hyperkalemia; myocardial infarction; secondary prevention; treatment discontinuation,"Fang, Gang; Annis, Izabela E.; Farley, Joel F.; Mahendraratnam, Nirosha; Hickson, Ryan P.; Stürmer, Til; Robinson, Jennifer G.",2018,10.1002/phar.2051,0,115
123,The unique impact of out-of-home placement and the mediating effects of child maltreatment and homelessness on early school success,"Increased national attention has underscored the importance of promoting educational well-being for children who have been placed in out-of-home care. The present study, informed by a developmental epidemiology framework, examined the unique impact of out-of-home placement and the mediating effects of child maltreatment and homelessness on the academic achievement and school adjustment of an entire cohort of second grade children in a large urban school district. Data on birth risks, placement history, child maltreatment, and homelessness from birth through second grade were integrated across municipal agencies for over 11,000 second grade students. Multiple Logistic Regression analyses demonstrate that children with a history of out-of-home placement were at increased risk for poor literacy and science achievement controlling for demographics and birth risks. These children also evidenced significantly higher levels of behavior problems and school suspensions than children with no out-of-home placement history. Maltreatment and homelessness were found to have significant mediating effects on the relationship between out-of-home placement and children's educational well-being. Implications for policy and practice were discussed. © 2007 Elsevier Ltd. All rights reserved.",Maltreatment; Mediating effects; Multiple Logistic Regression Analyses; Out-of-home placement,"Fantuzzo, John; Perlman, Staci",2007,10.1016/j.childyouth.2006.11.003,0,116
124,Evaluation of Responding in Peaceful and Positive Ways (RIPP): A School-Based Prevention Program for Reducing Violence among Urban Adolescents,Evaluated Responding in Peaceful and Positive Ways (RIPP) - a 6th-grade universal violence prevention program. Classes of 6th graders at 3 urban middle schools serving predominantly African American youth were randomized to intervention (N = 321) and control groups (N = 305). Intervention effects were found on a knowledge test but not on other mediating variables. RIPP participants had fewer disciplinary violations for violent offenses and in-school suspensions at posttest compared with the control group. The reduction in suspensions was maintained at 12-month follow-up for boys but not for girls. RIPP participants also reported more frequent use of peer mediation and reductions in fight-related injuries at posttest. Intervention effects on several measures approached significance at 6-month and 12-month follow-up. The program's impact on violent behavior was more evident among those with high pretest levels of problem behavior.,,"Farrell, Albert D.; Meyer, Aleta L.; White, Kamila S.",2001,10.1207/S15374424JCCP3004_02,0,117
125,"7,8-Dihydroxyflavone reduces sleep during dark phase and suppresses orexin A but not orexin B in mice","Brain-derived neurotrophic factor (BDNF) binds to Tropomyosin-receptor-kinase B (TrkB) receptors that regulate synaptic strength and plasticity in the mammalian nervous system. 7,8-Dihydroxyflavone (DHF) is a recently identified small molecule Trk B agonist that has been reported to ameliorate depression, attenuate the fear response, improve memory consolidation, and exert neuroprotective effects. Poor and disturbed sleep remains a symptom of major depressive disorder and most current antidepressants affect sleep. Therefore, we conducted sleep/wake recordings and concomitant measurement of brain orexins, endogenous peptides that suppress sleep, in mice for this study. Baseline polysomnograph recording was performed for 24 h followed by treatment with either 5 mg/kg of DHF or vehicle at the beginning of the dark phase. Animals were sacrificed the following day, one hour after the final treatment with DHF. Orexin A and B were quantified using ELISA and radioimmunoassay, respectively. Total sleep was significantly decreased in the DHF group, 4 h after drug administration in the dark phase, when compared with vehicle-treated animals. This difference was due to a significant decrease of non-rapid eye movement sleep, but not rapid eye movement sleep. DHF increased power of alpha and sigma bands but suppressed power of gamma band during sleep in dark phase. Interestingly, hypothalamic levels of orexin A were also significantly decreased in the DHF group (97 pg/mg) when compared with the vehicle-treated group (132 pg/mg). However, no significant differences of orexin B were observed between groups. Additionally, no change was found in immobility tests.","7,8-Dihydroxyflavone; BDNF; Depression; Forced swim test; Immobility; Sleep; Tail suspension test; TrkB receptor agonist","Feng, Pingfu; Akladious, Afaf A.; Hu, Yufen; Raslan, Yousef; Feng, James; Smith, Phillip J.",2015,10.1016/j.jpsychires.2015.08.002,0,118
126,Sexual differences in risk-taking behaviour of the Southern house wren during the nestling rearing stage,"When faced with a predator near the nest, breeding birds faced a dilemma: to continue providing parental care to their offspring exposing themselves to risk or to desert the nest for a brief period of time, exposing their offspring to harm due to the suspension of parental brooding and feeding. In this study, we analysed the response of nesting Southern house wrens (Troglodytes aedon musculus) to a predator model placed near the nest. The experiment was performed in 56 nests when nestling were 3–4 or 10–12 days old. The model (a plastic decoy of the Great Horned Owl Bubo virginianus) was placed at 3 m from the nest. Parent risk-taking was measured as the time elapsed for males and females to resume parental activities during the exposition to the model. We found that males and females delayed parental visits when exposed to the predator model, but females resumed them faster than males, irrespectively of the nesting stage. We also found that males refused to enter to the nest more frequently than females when exposed to the predator model. No effect of breeding experience or nesting stages was noted in the risk taking behaviour of adults. We suggest that sexual differences detected in this species reflect the higher ability of females to cope with the nestling needs and its lower lifetime expectancy.",Brood value; Harm-to-offspring; Life-history traits; Predation risk; Troglodytes,"Fernández, Gustavo J.; Corral, M. Gabriela; Llambías, Paulo E.",2015,10.1007/s10211-013-0177-x,0,119
127,Long-term safety and efficacy of levodopa-carbidopa intestinal gel in advanced Parkinson's disease,"Background: Levodopa-carbidopa intestinal gel (designated as carbidopa-levodopa enteral suspension in the United States) provides stable plasma levodopa concentrations and reduces motor fluctuations in advanced Parkinson's disease patients through continuous delivery of levodopa via percutaneous endoscopic gastrojejunostomy. We report long-term safety and efficacy outcomes from an open-label phase 3 treatment program. Methods: PD patients (n = 262) who completed a 12-week double-blind study and its 52-week open-label extension or a separate 54-week open-label study were enrolled in this ongoing phase 3 open-label, multinational study (NCT00660673). Safety and efficacy assessments were collected every 6 months. Results: Mean total duration of exposure to levodopa-carbidopa intestinal gel was 4.1 years (range, 1.2 to 6.9 years). The overall discontinuation rate was 34% (average annual discontinuation rate, 10%). Although most patients (94%) reported an adverse event, the rate of adverse events decreased over time; 53% experienced a serious adverse event. Of patients in this extension study, 54% required jejunal tube replacement during the study, and 37% required percutaneous endoscopic gastrostomy tube replacement. Most patients were on levodopa monotherapy. Patients maintained reductions in “off” time and increases in mean “on” time without dyskinesia from initial levodopa-carbidopa intestinal gel infusion to he study end point (P < 0.001; n = 81). Activities of daily living and quality-of-life assessments demonstrated significant improvements that persisted through the study. Conclusions: This long-term study demonstrates sustained and clinically meaningful benefits from levodopa-carbidopa intestinal gel in advanced PD patients. Although adverse event rates decreased over time, vigilance is required for device-related complications and adverse events. © 2018 The Authors. Movement Disorders published by Wiley Periodicals, Inc. on behalf of International Parkinson and Movement Disorder Society.",infusion; levodopa-carbidopa intestinal gel; Parkinson's disease; percutaneous endoscopic gastrojejunostomy; safety,"Fernandez, Hubert H.; Boyd, James T.; Fung, Victor S.C.; Lew, Mark F.; Rodriguez, Ramon L.; Slevin, John T.; Standaert, David G.; Zadikoff, Cindy; Vanagunas, Arvydas D.; Chatamra, Krai; Eaton, Susan; Facheris, Maurizio F.; Hall, Coleen; Robieson, Weining Z.; Benesh, Janet; Espay, Alberto J.",2018,10.1002/mds.27338,0,120
128,"Tamsulosin for Ureteral Stones in the Emergency Department: A Randomized, Controlled Trial","Study objective: The α-adrenergic antagonist tamsulosin hydrochloride has become an increasingly common adjunct in the treatment of ureteral calculi; however, its efficacy in a general emergency department (ED) population has not been investigated. Methods: We conducted a randomized, controlled trial of adult ED patients with distal ureteral calculi diagnosed by computed tomography scan. Patients were randomized to receive either a 10-day course of ibuprofen and oxycodone plus tamsulosin or ibuprofen and oxycodone alone. The primary outcome measure was successful spontaneous ureteral stone expulsion at 14 days. Secondary outcomes included time to stone passage, self-reported pain scores, number of colicky pain episodes, unscheduled return ED/primary care visits, number of days of missed work/usual function, amount of analgesic used, and adverse events. Results: Eighty subjects were enrolled in the study, with 77 completing the trial. Mean stone size was 3.6 mm (95% confidence interval [CI] 3.4 to 3.9). Successful spontaneous stone expulsion at 14 days was similar between the groups, with 27 (77.1%) subjects in the tamsulosin group and 24 (64.9%) subjects in the standard therapy group reporting spontaneous stone passage, a difference of 12% (95% CI -8.4% to 32.8%). At 2-, 5-, and 14-day follow-up, there were no clinically important (or statistically significant) differences between the groups for any secondary outcome measure. No adverse events were reported in either group. Conclusion: In this cohort of adult ED patients with distal ureteral calculi, treatment with tamsulosin did not substantially improve any of the studied outcome measures compared with treatment with ibuprofen and oxycodone alone. © 2009.",,"Ferre, Robinson M.; Wasielewski, Jessica N.; Strout, Tania D.; Perron, Andrew D.",2009,10.1016/j.annemergmed.2008.12.026,0,121
129,"Hyperactive children as young adults: Driving abilities, safe driving behavior, and adverse driving outcomes","ADHD has been linked to poorer driving abilities and greater adverse outcomes (crashes, citations) in clinic-referred cases of teens and adults with ADHD. No study, however, has focused systematically on ADHD children followed into adulthood. The present paper does so while measuring driving-related cognitive abilities, driving behavior, and history of adverse driving outcomes. A multi-method, multi-source battery of driving measures was collected at the young adult follow-up on hyperactive (H; N = 147; mean age = 21.1) and community control children (CC; N = 71; mean age = 20.5) followed for more than 13 years. More of the H than CC groups had been ticketed for reckless driving, driving without a license, hit-and-run crashes, and had their licenses suspended or revoked. Official driving records found more of the H group having received traffic citations and a greater frequency of license suspensions. The cost of damage in their initial crashes was also significantly greater in the H than CC group. Both self-report and other ratings of actual driving behavior revealed less safe driving practices being used by the H group. Observations by driving instructors during a behind-the-wheel road test indicated significantly more impulsive errors. Performance on a simulator further revealed slower and more variable reaction times, greater errors of impulsiveness (false alarms, poor rule following), more steering variability, and more scrapes and crashes of the simulated vehicle against road boundaries in the H than in the CC group. These findings suggest that children growing up with ADHD may either have fewer driving risks or possibly under-report those risks relative to clinic-referred adults with this disorder. Deficits in simulator performance and safe driving behavior, however, are consistent with clinic-referred adults with ADHD suggesting ongoing risks for such adverse driving outcomes in children growing up with ADHD. © 2006 Elsevier Ltd. All rights reserved.",Attention deficity hyperactivity disorder; Driving; Driving accidents; Follow-up research,"Fischer, Mariellen; Barkley, Russell A.; Smallish, Lori; Fletcher, Kenneth",2007,10.1016/j.aap.2006.06.008,0,122
130,Addressing the Early Childhood Mental Health Needs of Young Children: Evaluating Child and Family Outcomes,"The prevalence of serious emotional and behavioral concerns in early childhood is estimated to be in the range of 9% to 14% of the general population (Brauner & Stephens, 2006) and as high as 24% among low-income children (Brown, Copeland, Sucharew, & Kahn, 2012). Unfortunately, mental health concerns among young children often go unidentified and untreated (Breitenstein, Hill, & Gross, 2009). As longer-term research has illustrated the impact of untreated mental health issues in early childhood on later health, social-emotional functioning, and academic success (Zero to Three, 2012), intervention with families facing such concerns offer opportunities to positively impact the trajectory of these issues. Using data from a longitudinal, pre–post design, this secondary analysis examines the delivery (n = 808) and outcomes (n = 664) of child- and family-centered early childhood mental health (ECMH) services delivered in home by 6 agencies. Although ECMH treatment models differed across sites, parents reported significant reductions in children's internalizing and externalizing behavior problems, and service providers noted significant improvements in parent–child relationship functioning over time, particularly for children with a relationship disorder. Future research using a rigorous experimental design is needed to confirm these preliminary findings. The article concludes with a discussion of the implications of this work for practice, research, and policy.",,"Fischer, Robert L.; Anthony, Elizabeth R.; Lalich, Nina; Blue, Marci",2014,10.1080/01488376.2014.930947,1,123
