Key,title,abstract,keywords,authors,year,doi,Included,ID
382,Baby doe redux? The Department of Health and Human Services and the Born-Alive Infants Protection Act of 2002: A cautionary note on normative neonatal practice,"The Born-Alive Infants Protection Act (BAIPA), passed by Congress in 2002, has attracted little publicity. Its purposes were, in part, ""to repudiate the flawed notion that a child's entitlement to the protections of the law is dependent on whether that child's mother or others want him or her."" Understood as antiabortion rhetoric, the bill raised little concern among physicians at the time of legislative hearings and passed in both Houses by overwhelming majorities, hardly suggesting contentious legislation. After its signing into law, the Neonatal Resuscitation Program (NRP) Steering Committee issued an opinion stating that ""[BAIPA] should not in any way affect the approach that physicians currently follow with respect to the extremely premature infant."" This interpretation of the law, however, may have been short sighted. In April 2005, the US Department of Health and Human Services (DHHS) brought life to the BAIPA, announcing: ""As a matter of law and policy, [DHHS] will investigate all circumstances where individuals and entities are reported to be withholding medical care from an infant born alive in potential violation of federal statutes."" The agency issued instructions to state officials on how the definitional provision within the BAIPA interacts with the Emergency Medical Treatment and Labor Act (EMTALA) and the Child Abuse Prevention and Treatment Act (CAPTA). These interagency memoranda potentially resurrect dormant governmental oversight of newborn-treatment decisions and thus may have influence over normative neonatal practice. Under the BAIPA, the DHHS interprets EMTALA to protect all ""born-alive"" infants; hospitals and physicians violating regulatory requirements face agency-sanctioned monetary penalties or a ""private right of action by any individual harmed as a direct result."" According to its memorandum, the DHHS will investigate allegations of EMTALA violations whenever it finds evidence that a newborn was not provided with at least a medical screening examination under circumstances in which a ""prudent layperson observer"" could conclude from the infant's ""appearance or behavior"" that it was ""suffering from an emergency medical condition."" The memorandum fails to clarify which observers qualify as prudent, what infant appearance or behavior is relevant, or what defines an emergency medical condition. Because these evaluative criteria are not constrained by reference to relevant standards of medical care, the agency arguably substitutes a nonprofessional's presumed sagacious assessment of survivability for reasonable medical judgment. Indeed, under a straightforward reading of the instruction, a family member could conceivably trigger an investigation after observing a relative deliver a 20-week fetus who maintains a heartbeat for an hour before its death. Most physicians would not consider this an emergency medical condition and, rather than perform a screening examination, would provide comfort for the newborn and support for the family. The guideline, however, does not state that professional acumen trumps the layperson's observations in these instances; thus, physicians are left unclear about whether screening examinations are required for all newborns regardless of a priori, reasoned considerations of survivability. In this context, the NRP Steering Committee opinion states that ""at the time of delivery . . . the medical condition and prognosis of the newly born infant should be assessed. At that point decisions about withholding or discontinuing medical treatment that is considered futile may be considered by . . . providers in conjunction with the parents acting in the best interest of their child."" However, most pediatricians skilled in screening and resuscitation are not currently called on to perform this function when the gestational age of a nonviable fetus is reasonably certain before delivery. If under the law screening is now required at any gestational age, professional procedure immediately after previable births may need modification. More worrisome, threatened aggressive investigations of alleged EMTALA violations at the soft edges of viability, where futility remains a matter of debate, jeopardize the normative ethical practice of offering discretionary palliative care. The DHHS sent its other instruction to state child protective services agencies responsible for implementing CAPTA regulations; it reiterates the limited situations in which physicians may withhold medical treatment from infants and reemphasizes the local role of ""individuals within health care facilities"" to notify authorities of suspected infractions. Its real import, however, is insistence on local execution of legal remedies to prevent nontreatment decisions deemed impermissible by the 1984 Baby Doe rules. Because this new directive encourages governmental oversight of treatment decisions involving imperiled newborns, a period of benign regulatory neglect seems to be over. The federal CAPTA rules arguably remove quality-of-life considerations from the decision-making calculus and therefore may conflict with the best-interests paradigm advocated by the American Academy of Pediatrics and NRP. How courts will respond to the DHHS interpretation of EMTALA and CAPTA under the BAIPA remains unclear. Federal courts have yet to authoritatively examine alleged EMTALA violations involving newborn treatment decisions at the limits of viability. The Wisconsin Supreme Court has permitted an EMTALA claim to go to trial where physicians allegedly did not screen or resuscitate a 22-week newborn delivered in an emergency department, and a lower appellate court has relied on CAPTA to hold that parents do not possess the right to choose against resuscitating an extremely premature newborn. The Texas Supreme Court recently granted physicians the paternalistic prerogative to resuscitate imperiled newborns without attention to parental preference under a common law doctrine of ""emergent circumstances."" These judicial decisions undermine the ethical discretion parents are typically afforded in decision-making before and after delivery in these morally complex situations. The DHHS interpretation of the BAIPA may encourage jurisdictional creep of these kinds of pronouncements as the agency seeks to expand legal protections for born-alive infants. The US Supreme Court has stated that ""courts must presume that a legislature says in a statute what it means and means in a statute what it says there""; thus, judges interpret law by analyzing ""concrete statutory language, not by reference to abstract notions of generalized legislative intent."" The BAIPA indiscriminately defines ""born alive"" to include an infant ""at any stage of development . . . regardless of whether the expulsion or extraction occurs as a result of natural or induced labor, cesarean section, or induced abortion,"" and it makes no reference to standards of care or best interests, nor does it specifically protect a parent's decision-making authority. Under the law's strict logic, an 18-week miscarried fetus with a detectable heart beat after delivery is entitled to the full protections of the law as determined by ""any Act of Congress, or any ruling, regulation, or interpretation of the various administrative bureaus and agencies."" Before concluding that the BAIPA would not affect normative neonatal practice, the NRP Steering Committee should have analyzed the act's actual statutory language and avoided relying heavily on imprecise legislative intent. The BAIPA's congressional sponsors did claim that the law ""will not mandate medical treatment where none is currently indicated,"" but such political rhetoric is often not sufficient to render law innocuous years after separation from its legislative history. Besides, nowhere in the House record does the majority explicitly acknowledge that discretion to decide the fate of imperiled newborns invests in parents, in consultation with physicians; indeed, the bill's stated purpose was to repudiate that notion. At best, legislators recognized that physicians disagree about the efficacy of resuscitating at the limits of viability, and therefore the current standard of care permits doctors to deem resuscitation a futile endeavor. However, judges may resist characterizing resuscitation as futile, given its poor analytical fit, and substantial public-policy concerns regarding discrimination against future disabled individuals could easily tip a court to preserve incipient, at least, physiologic life under the BAIPA's all-encompassing definition of born alive. Copyright © 2005 by the American Academy of Pediatrics.",Ethics; Health policy; Death and dying; Decisionmaking; Extremely preterm infants,"Sayeed, Sadath A.",2005,10.1542/peds.2005-1590,0,362
383,"Evaluation of insulin-like growth factor-1, total thyroxine, feline pancreas-specific lipase and urinary corticoid-to-creatinine ratio in cats with diabetes mellitus in Switzerland and the Netherlands","Objectives: The aim of the study was to evaluate circulating insulin-like growth factor-1 (IGF-1), feline pancreas-specific lipase (fPLI) and total thyroxine (TT4) concentrations and urinary corticoid-to-creatinine ratio (UCCR) as indicators for the prevalence of acromegaly, pancreatitis, hyperthyroidism and hypercortisolism in cats with diabetes mellitus. Methods: Blood and urine samples were collected from diabetic cats treated in primary care clinics in Switzerland and the Netherlands. Standardised questionnaires and physical examination forms provided clinical information from owners and veterinarians. Laboratory testing included serum biochemistry profile analysis and measurement of circulating fructosamine, IGF-1, fPLI, and TT4 concentrations and UCCR. CT of the pituitary gland was performed using a multidetector computed tomography scanner. Results: Blood samples were available from 215 cats and urine samples were collected at home from 117 cats. Age ranged from 2–18 years (median 12 years) and body weight from 2.7–12.3 kg (median 5.5 kg). Sixty-five percent of the cats were castrated male and 35% were female (33% spayed); 82% were domestic shorthair cats. Eighty percent of cats received a porcine insulin zinc suspension, 19.5% insulin glargine and 0.5% a human neutral protamine hagedorn insulin. Thirty-six of 202 (17.8%) cats had IGF-1 concentrations >1000 ng/ml. Serum fPLI, and TT4 concentrations and UCCR were increased in 86/196 (43.9%), 9/201 (4.5%) and 18/117 cats (15.3%), respectively. Prevalence did not differ between countries. Conclusions: Hyperthyroidism is rare, whereas increased fPLI concentration, possibly reflecting pancreatitis, is common in diabetic cats. The high UCCR may reflect activation of the hypothalamus–pituitary–adrenal axis, which also occurs in diabetic humans. The percentage of cats with increased IGF-1 was high but lower than reported in recent studies.",,"Schaefer, Sandra; Kooistra, Hans S.; Riond, Barbara; Suchodolski, Jan S.; Steiner, Jörg M.; Prins, Marrit; Zini, Eric; Reusch, Claudia E.",2017,10.1177/1098612X16664390,0,363
384,"Educational experiences of children in foster care: Meta-analyses of special education, retention and discipline rates","The educational achievements of children in foster care have been determined to be below average in individual studies. In the present investigation, 31 studies were examined via four meta-analyses to answer questions regarding the educational status of children in out-of-home placements in multiple countries. Data analysis encompassed the following variables: special education eligibility rates, grade retention rates and disciplinary rates. Exploratory meta-analyses uncovered conclusive results in this project, illuminating common educational challenges faced by children living in foster care across countries. Students living in out-of-home care are disproportionately represented in special education. They are prevented from moving to advanced grade levels at alarming rates. In addition, these students are disciplined frequently in the school setting. Implications for serving fostered youth include promoting pre-referral interventions and positive behavioural supports. © 2007 SAGE Publications.",Meta-analysis; Suspension; Special education; Discipline; Grade retention; Expulsion; Foster care; Out-of-home care,"Scherr, Tracey G.",2007,10.1177/0143034307084133,0,364
385,Study Monitoring in Emergency Care Trials: Lessons from the Resuscitation Outcomes Consortium Continuous Chest Compressions Trial,"Objective: Clinical trial investigators often assemble internal study monitoring committees (SMCs) to measure individual or group adherence with trial performance benchmarks. We examined the processes and results of study monitoring in an international trial of out-of-hospital cardiac arrest. Methods: We studied SMC operations for the Resuscitation Outcomes Consortium (ROC) Continuous Chest Compressions (CCC) trial, which compared continuous with interrupted chest compressions upon survival after out-of-hospital cardiac arrest. The SMC defined trial performance benchmarks, which included compliance with the intervention, cardiopulmonary resuscitation (CPR) process data availability and timely data completion. Trial investigators received monthly performance reports. We determined rates of trial noncompliance and suspension from the trial. Results: ROC-CCC enrolled a total of 23,711 subjects in the primary analysis population. Across 113 enrolling agencies, the SMC monitored performance for a total 2,367 agency-months. Emergency medical services agencies were on probation for a total of 178 (7.5%) agency-months. Fifty-five agencies were placed on probation at least once, of which 78% improved their performance and were approved for continued participation in the trial. A total of 12 agencies were suspended from trial participation. Data monitoring resulted in high-quality CPR (mean chest compression fraction = 0.80), 87% CPR process availability and timely data completion (75th and 95th percentiles prehospital data = 22 and 57 days; hospital data = 58 and 118 days). Conclusions: Study monitoring procedures may play an important role in ensuring the performance quality in acute care clinical trials.",,"Schmicker, Robert H.; Nichol, Graham; Callaway, Clifton W.; Cheskes, Sheldon; Sopko, George; Wang, Henry E.",2019,10.1111/acem.13810,0,365
386,Fictional Worlds and the Real World in Early childhood Drama Education,"Examined the ways young children react, behave, accept, and enjoy theater performances, and the degree to which they live in the aesthetic experience of the performance. Children (aged 5–8 yrs) in a natural setting watched plays, then completed brief discussions. Other collected data included children's body language, explicit expressions of emotions, and reactions to others during the performance. Results show that throughout the performance, children generally moved between low, high, and optimal aesthetic distances. The cases of a female (aged 7 yrs) and a male (aged 6 yrs) show a variety of reactions to theatrical performance, which vacillate between belief and its suspension. (PsycINFO Database Record (c) 2017 APA, all rights reserved)",,"Schonmann, Shifra",2005,10.1007/0-306-47511-1_12,0,366
387,Using functional behavior assessment in general education settings: Making a case for effectiveness and efficiency,"Under the 1997 Individuals with Disabilities Education Act, schools have a legal obligation to conduct functional behavior assessments (FBAs) when developing intervention plans for students with disabilities whose behaviors lead their individualized education program teams to consider a change in educational placement, including suspension and expulsion. However, FBA also holds significant promise as a procedure to be used proactively with students with behavioral challenges who are educated in part, or wholly, in general education classrooms. Unfortunately, current conceptualizations of FBA as a methodologically rigorous procedure pose significant and possibly insurmountable barriers to proactive implementation in general education settings. The authors analyze these barriers through a targeted review of the literature, an examination of how the characteristics of general education settings promote the use of less demanding FBA methodologies, and a consideration of situations in which certain FBA procedures generally are contraindicated. Finally, they advocate an active research agenda that is responsive to the particular challenges of public school settings and FBA students with and at risk for mild disabilities.",,"Scott, Terrance M.; Bucalos, Anne; Liaupsin, Carl; Nelson, C. Michael; Jolivette, Kristine; DeShea, Lise",2004,10.1177/019874290402900207,0,367
388,"An early male adolescent with externalizing behaviors, school failure, and a colostomy.","CASE: Jeff is a 14 (1/2) years old ninth grader who presents with his mother, father, and step-father because he is failing in school. Jeff was born with an imperforate anus, and he had several surgical procedures in the first few years of life. He has a colostomy, but it is not clear how well he cares for it independently. Jeff's parents state that there other concern is that to prepare for school each morning or for other activities, they literally remind him of each step. Jeff has been active and disruptive since preschool, but is also described as ""charming."" School work and peer relations improved following a diagnosis of attention-deficit hyperactivity disorder (ADHD) in the second grade and treatment with a long-acting stimulant medication. An Independent Education Plan (IEP) in second grade included achievement tests that demonstrated above grade level scores. Jeff continued to have problems with written expression, but did quite well in verbal expression. By seventh grade, Jeff complained to his parents that he ""wasn't fun to be around,"" and refused to take medication for ADHD. He increasingly refused to do most of his homework or class work. Grades were approaching failing levels in the eighth grade when he was suspended twice for impulsive behaviors-drawing a picture of a gun pointed at another student, and signing a petition stating that a classmate was gay. After his second suspension, he was sent to a continuation school, where he resisted doing the required work, failed each subject, and socialized with peers. Jeff is failing in ninth grade although his teachers describe him as respectful in the classroom. His parents divorced when Jeff was a preschooler, and they do not agree on how to manage Jeff. Jeff's father has not supported medication for the treatment of ADHD. The parents tried numerous strategies to help Jeff, including improving organizational skills, offering rewards and punishments and counseling; they have participated in parenting classes. The parents acknowledge that Jeff always tries to negotiate with them and they often give in. There is no known substance abuse or illegal behavior, although he has demonstrated destructiveness and stealing at home. Jeff's mother remarried a year ago, and her husband backed her in setting more strict limits for Jeff; at Jeff's request, he is currently living with his father most of the time.",,"Sedberry, Deborah; Tarbell, Sally; Stein, Martin T.",2008,10.1097/dbp.0b013e3181886f20,0,368
390,Decreased expression of the righting reflex and locomotor movements in breech-presenting newborns in the first days of life,"Aim: To investigate differences between the infants born in occipital and breech presentation relative to the passive and active motility. Method: A prospective study was conducted in the period from 2006 to 2007 at the Department of Obstetrics and Gynecology in Novi Sad. Subjects were 50 breech-presenting and 87 occipital-presenting term newborns delivered by elective cesarean section following a regular course of pregnancy, without fetal, newborn, and the pregnant female disease. Outcome measures were popliteal angle; extension of the hip-joint; ventral flexion and dorsal extension in the axis; spontaneous displacement; crawling reflex; righting reaction in vertical and sitting positions; righting reaction in horizontal suspension, the automatic walking investigated on the second and fourth day of life. Results: Except for righting reaction in horizontal suspension, the newborns from breech presentation had a significantly lower score for all investigated parameters of active movements at the first and second examination. There was no difference between occipital and breech-group relative to the ventral flexion and dorsal extension in the axis. The popliteal angle was significantly increased, whereas the extension in the hip joint was significantly decreased in the breech group. Conclusions: Investigations showed a significantly decreased expression of active movements in the breech group, which cannot be explained only by postural deformities. © 2008 Elsevier Ireland Ltd. All rights reserved.",Pregnancy; Newborn; Breech presentation; Cesarean section; Neurological examination,"Sekulić, Slobodan; Žarkov, Marija; Slankamenac, Petar; Božić, Ksenija; Vejnović, Tihomir; Novakov-Mikić, Aleksandra",2009,10.1016/j.earlhumdev.2008.11.001,0,369
391,Analysis of Response Covariation Among Multiple Topographies of Food Refusal,"This study examined the effects of sequentially introducing treatment across multiple topographies of food refusal. Treatment with nonremoval of the spoon produced an increase in food acceptance and a decrease in disruption, but expulsion of food increased. When expulsion was treated, packing of food increased. Finally, when packing was treated, all refusal behaviors remained low, and acceptance continued to occur at high and stable levels.",,"Sevin, Bart M.; Gulotta, Charles S.; Sierp, Barbara J.; Rosica, Leigh A.; Miller, Lorionna J.",2002,10.1901/jaba.2002.35-65,0,370
392,Depression-like symptoms of withdrawal in a genetic mouse model of binge methamphetamine intake,"Binge methamphetamine (MA) users have higher MA consumption, relapse rates and depression-like symptoms during early periods of withdrawal, compared with non-binge users. The impact of varying durations of MA abstinence on depression-like symptoms and on subsequent MA intake was examined in mice genetically prone to binge-level MA consumption. Binge-level MA intake was induced using a multiple-bottle choice procedure in which mice were offered one water drinking tube and three tubes containing increasing concentrations of MA in water, or four water tubes (control group). In two studies, depression-like symptoms were measured using a tail-suspension test and a subsequent forced-swim test, after forced abstinence of 6 and 30 hours from a 28-day course of chronic MA intake. An additional study measured the same depression-like symptoms, as well as MA intake, after prolonged abstinence of 1 and 2 weeks. MA high drinking mice and one of their progenitor strains DBA/2J escalated their MA intake with increasing MA concentration; however, MA high drinking mice consumed almost twice as much MA as DBA/2J mice. Depression-like symptoms were significantly higher early after MA access was withdrawn, compared to levels in drug-naïve controls, with more robust effects of MA withdrawal observed in MA high drinking than DBA/2J mice. When depression-like symptoms were examined after 1 or 2 weeks of forced abstinence in MA high drinking mice, depression-like symptoms dissipated, and subsequent MA intake was high. The MA high drinking genetic mouse model has strong face validity for human binge MA use and behavioral sequelae associated with abstinence.",addiction; 4-bottle choice; forced abstinence; forced-swim test; selected-lines; tail-suspension test,"Shabani, Shkelzen; Schmidt, Bryan; Ghimire, Bikalpa; Houlton, Sydney K.; Hellmuth, Laura; Mojica, Erika; Phillips, Tamara J.",2019,10.1111/gbb.12533,0,371
393,Treating liquid expulsion in children with feeding disorders,"In the current investigation, we compared and evaluated the effects of two intervention procedures, a modified chin prompt and reclined seating, on the liquid expulsion of 2 children with feeding disorders. For both participants, expulsion decreased to clinically meaningful levels when we added the modified chin prompt or reclined seating to a treatment package consisting of differential reinforcement of acceptance, nonremoval of the cup, and re-presentation. We discuss possible mechanisms underlying the effects of the 2 interventions and areas for future research.",expulsion; chin prompt; feeding disorder; pediatric feeding disorder; re-presentation; reclined seating,"Shalev, Rebecca A.; Milnes, Suzanne M.; Piazza, Cathleen C.; Kozisek, Jennifer M.",2018,10.1002/jaba.425,0,372
394,Comparison of Bite-Presentation Methods in the Treatment of Food Refusal,"The current study examined the rate of expulsions and mouth cleans across 3 presentation methods (upright spoon, flipped spoon, Nuk brush) for a 3-year-old girl with a feeding disorder. The participant expelled all bites presented on an upright spoon. Results showed reduced rates of expulsions and increased mouth cleans during the flipped spoon and Nuk brush presentation methods. © 2010 Society for the Experimental Analysis of Behavior.",,"Sharp, William G.; Harker, Shelly; Jaquess, David L.",2010,10.1901/jaba.2010.43-739,0,373
