Key,title,abstract,keywords,authors,year,doi,Included,ID
251,"Parents as Teachers (PAT) home-visiting intervention: A path to improved academic outcomes, school behavior, and parenting skills","The time from conception to young childhood is crucial in terms of brain-, social-, emotional-, and cognitive-development. Given the impact that parenting has on child developmental outcomes, home-visiting programs may be a viable means of improving parenting and thus increasing positive child developmental outcomes. Parents as Teachers (PAT) is a home visitation program that promotes parenting skills and abilities to improve parenting skills and child development outcomes. The current study used a matched comparison group quasi-experimental design and assessed three years of academic and school disciplinary data from a school district in Arizona to determine the impact of PAT on student reading, math, and English Language skills as well as absence rates and school suspension rates relative to a non-PAT group of students. Further, the study examined whether the program influenced parenting behavior. Findings indicated that compared to the non-PAT control group, the PAT student group performed better in terms of reading and math achievement and had a significantly lower rate of absenteeism, in-school-suspensions, and out-of-school-suspension. Further, PAT parents showed increased scores on parenting measures at post-test relative to pre-test. Taken together, findings indicate that participation in the PAT program is a viable means for improving child academic outcomes and school behavior and improving parenting behavior. Implications for future research are discussed.",Academic achievement; Home-visiting; Parenting; Parents as Teachers; Prevention,"Lahti, Michel; Evans, Caroline B.R.; Goodman, Greg; Schmidt, Michele Cranwell; LeCroy, Craig W.",2019,10.1016/j.childyouth.2019.01.022,1,238
252,Pharmacokinetics of Phenobarbital in Microenema Via Macy Catheter Versus Suppository,"Context The oral route is compromised for nearly all patients approaching death. When agitation, seizures, or other intractable symptoms occur, a quick, discreet, comfortable, and effective alternate route for medication delivery that is easy to administer in the home setting is highly desirable. Objectives To characterize the early absorption profile, variability, and comfort of phenobarbital given in microenema suspensions delivered via the Macy Catheter® (MC) vs. the same dose given via suppository. Methods This was a randomized, open-label, crossover study comparing the early absorption profile of equal doses of phenobarbital administered rectally in three treatment phases: phenobarbital suppository and two different microenemas with phenobarbital tablets crushed and suspended in 6 mL (MC-6) or 20 mL (MC-20) of tap water. Results Mean plasma phenobarbital concentrations at 10 minutes were 12× higher for MC-20 and 8× higher for MC-6 compared to suppository. Concentrations achieved in 30 minutes via MC-20 took almost three hours to achieve with suppository. Mean AUC values were higher for MC-20 and MC-6 (82% and 46%, respectively) vs. suppository (P < 0.05). There was less variability in absorption for MC-20 and MC-6 (1.4- to 1.9-fold difference) compared to a 4.4-fold difference via suppository. MC administrations were reported as ""not uncomfortable"" compared to suppositories, which were reported as ""mildly uncomfortable"" (P < 0.05). Conclusion These results suggest phenobarbital oral tablets crushed and suspended in water and administered via the MC is superior to suppository in delivering the medication reliably and rapidly.",hospice care; phenobarbital; Rectal administration; suppository,"Lam, Y. W.Francis; Lam, Ansom; Macy, Brad",2016,10.1016/j.jpainsymman.2015.12.339,0,239
253,Students with Dual Diagnosis: Can School-Based Mental Health Services Play a Role?,"This article describes and investigates initial findings from the Esperanza Mental Health Services (EMHS) Program, which is an intensive outpatient program that provides individual and group mental health services for students with “dual diagnosis” or developmental disabilities and co-occurring mental health problems. Previous research substantiates that the mental health needs of this population are significant, yet often go unaddressed in school settings. Preliminary outcomes for a sample of 61 children ages 4–22 suggest improvements in important school indicators, such as suspensions and absences during the year of program implementation, as well as positive changes in parent-reported mental health functioning. Lastly, parent satisfaction regarding these services and supports was high. The implications of these results for a proposed school-based mental health service delivery model within a multi-tiered system of prevention and intervention are discussed.",Dual diagnosis; multi-tiered services; school-based mental health,"Lambros, Katina; Kraemer, Bonnie; Wager, James Derek; Culver, Shirley; Angulo, Aidee; Saragosa, Marie",2016,10.1080/19315864.2015.1091055,0,240
254,A prospective study of omeprazole suspension to prevent clinically significant gastrointestinal bleeding from stress ulcers in mechanically ventilated trauma patients,"Objective: To prospectively evaluate the incidence of clinically significant bleeding, side effects, and cost of therapy in mechanically ventilated trauma patients at high risk for stress ulcers who received simplified omeprazole suspension (SOS). Methods: Prospective, evaluative study in a Level I trauma center. Mechanically ventilated trauma patients admitted with at least one additional risk factor for stress ulcer development received SOS for stress ulcer prophylaxis. Results: Sixty trauma patients were enrolled. The mean Injury Severity Score was 27.3. After starting SOS, there were no cases of clinically significant upper gastrointestinal bleeding related to stress ulceration. Baseline pH was 3.3, and mean gastric pH after SOS was increased to 6.7 (p < 0.005). There were no adverse effects thought to be related to omeprazole suspension. Incidence of nosocomial pneumonia after beginning SOS was 28.3%. The cost of acquisition plus administration of SOS was $13.13 per day, whereas the cost of drug acquisition alone was $3.83 per day. Conclusion: In a prospective, evaluative study of 60 trauma patients who required mechanical ventilation and had at least one additional risk factor for stress ulcer development, omeprazole suspension prevented clinically significant gastrointestinal bleeding, maintained excellent control of gastric pH, produced no toxicity, and was the least costly medication alternative.",Omeprazole; Stress ulcer; Trauma,"Lasky, Michael R.; Metzler, Michael H.; Phillips, Jeffrey O.",1998,,0,241
255,Taxonomy of clinical encounters during the first 90 days post-delivery of an initial lower limb prosthesis,"Background: The incidence and etiology of prosthetic services utilization is poorly understood during the first 90 days post-delivery of the initial lower limb prosthesis. This period is of critical importance, as prevailing policy dictates limits on the reimbursement for certain services provided during this time period. The first step in understanding the financial ramifications of such policy is to examine the taxonomy behind clinical encounters during this tenuous time period. Objectives: Quantify and categorize clinical encounters by incidence and etiology. Study design: Retrospective chart review. Methods: A central database containing data on prosthetic services was examined. Incidence and etiology were extracted through independent review of each patient chart. Results: A total of 537 unique patients were identified, with 109 meeting the inclusion criteria. Chi-square testing showed that comfort (p < 0.05), cosmesis (p < 0.01), and mechanical failure (p < 0.001) yielded statistical significance in scheduled versus unscheduled visits. Stepwise regression analysis demonstrated that both sex and K-level were important predictors of unscheduled visits. Conclusion: Taxonomization of clinical encounters experienced during the first 90 days provides a framework for future studies to be conducted. The data provided can serve as a basis for informing reimbursement policy, workforce planning, and advocacy. Clinical relevance: Comfort is the most frequent reason for a clinical encounter during the first 90 days after delivering a lower limb prosthesis. The data on the taxonomy behind the clinical encounters can be used to guide workforce planning and advocate for just reimbursement policy that better reflect patient’s needs.",advocacy; Health policy; Medicare; prosthetics; reimbursement,"Lee, Daniel Joseph; Wininger, Michael; Mahler, David; Parisi, Mark",2018,10.1177/0309364618774053,0,242
256,"Correlation patterns between pretend play and playfulness in children with autism spectrum disorder, developmental delay, and typical development","This study aims to explore the relationships between pretend play and playfulness in children with autism spectrum disorder (ASD), children with developmental delay (DD), and typically developing (TD) children. Twenty children with ASD, 20 children with DD, and 20 TD children aged 3-7 years 11 months entered the play conditions for the assessments of pretend play and playfulness. Data were analyzed using the Pearson correlation coefficient and a regression analysis. Results revealed that the play patterns of the ASD group indicated greater reliance on others to generate novel ideas of how to play. The number of imitated actions and amount of elaborate pretend play were positively associated with the suspension of reality and framing dimensions of playfulness, respectively. In the DD group, pretend play performance was more closely related to the internal locus of control of playfulness. The play patterns for the TD group, as expected, involved more symbolic play and internal control. The results of this study provide further understanding of the relationships between pretend play and playfulness in children with ASD, children with DD, and TD children. Assisting children with ASD to engage in elaborate pretend play through adult facilitation may help improve the framing and suspension of reality dimensions of their playfulness.",Autism spectrum disorder; Playfulness; Pretend play,"Lee, Ya Chen; Chan, Ping Chen; Lin, Shu Kai; Chen, Cheng Te; Huang, Chien Yu; Chen, Kuan Lin",2016,10.1016/j.rasd.2016.01.006,0,243
258,A randomized study of neighborhood effects on low-income children's educational outcomes,"Experimental data from the Moving to Opportunity for Fair Housing Demonstration were used to examine (a) if moving from high- to low-poverty neighborhoods (via randomization) was associated with low-income minority children's achievement, grade retention, and suspensions/expulsions; (b) if moving minimized gender differences in these outcomes; and (c) potential mediators of observed program effects. Data on school-age children (mean age = 11.79 years, SD = 3.26) were obtained from standardized assessments and parent and adolescent interviews during the New York City site's 3-year follow-up evaluation (N = 588). Moving to low-poverty neighborhoods had positive effects on 11-18-year-old boys' achievement scores compared with those of their peers in high-poverty neighborhoods. These male adolescents' scores were comparable to females' scores, whereas male adolescents in high-poverty neighborhoods scored 10 points lower than female peers. Homework time and school safety partially accounted for program effects. From a policy perspective, the program benefited disadvantaged male adolescents at high risk for dropping out of school.",,"Leventhal, Tama; Brooks-Gunn, Jeanne",2004,10.1037/0012-1649.40.4.488,0,244
259,An Assessment tool for early intervention in cases of truancy,"The author classifies the factors within the child, home, school, and community that may contribute to truancy. The classification schema can serve as a tool to guide school social workers in assessing the etiology of truancy in individuals and developing approaches to prevention through early intervention. © 1984 National Association of Social Workers.",,"Levine, Renee Shai",1984,10.1093/cs/6.3.133,1,245
260,Runaway and Throwaway Youth: A Case for Early Intervention with Truants,"The preliminary data of a study done to identify indicators of runaway and throwaway youth support the contention that early intervention with truants can lead to prevention of these phenomena. School support personnel and school and community services are especially important in working with this population. © 1986 by the National Association of Social Workers, Inc.",,"Levine, Renee Shai; Metzendorf, Diane; VanBoskirk, Kathryn A.",1986,10.1093/cs/8.2.93,0,246
261,Systemic inflammatory response syndrome treatment by powdered sorbent pheresis: The biologic-detoxification plasma filtration system,"Systemic inflammatory response syndrome (SIRS) is one of the most common causes of death in intensive care unit patients. The detoxification plasma filtration (DTPF) system (HemoCleanse, Inc., West Lafayette, IN) combines the DT hemodiabsorption system in series with a push-pull pheresis PF system (a suspension of powdered sorbents surrounding 0.5 μm plasma filter membranes). Bidirectional plasma flow (at 80-100 ml/min) across the PF membranes provides direct contact between plasma proteins and powdered sorbents, as well as clearance of cytokines (tumor necrosis factor-α, interleukin-1β, and interleukin-6) at a rate of 15-25 ml/min, without evidence of saturation for 90 minutes. In a U.S. Food and Drug Administration approved study we treated eight patients with SIRS and organ failure with a single DTPF treatment, using powdered charcoal as sorbent in four patients and powdered charcoal and silica in four patients. Treatments proceeded for 6 hours with proper heparin anticoagulation (activated clotting time 250-300 sec) and appeared safe. All patients improved during the treatments and each had increased blood pressure and decreased need for pressor agents. Plasma cytokine levels stabilized or decreased during treatment and were significantly lower the morning after treatment. Multiple organ dysfunction (MOD) and Acute Physiology Chronic Health Evaluation II scores and organ function gradually improved in most patients, and two patients survived for more than 28 days and two for more than 14 days. The DTPF System may prove beneficial in treatment of patients with sepsis.",,"Levy, Howard; Ash, Stephen R.; Knab, William; Steczko, Janusz; Carr, David J.; Blake, Donald E.",1998,10.1097/00002480-199809000-00072,0,247
262,Salicylate toxicity associated with administration of Percy Medicine in an infant,"Percy Medicine is a nonprescription gastrointestinal suspension containing bismuth subsalicylate as the active ingredient (1050 mg/10-ml dose). A 3-month-old infant with colic developed salicylate toxicity requiring hospitalization in the pediatric intensive care unit (PICU) as a result of continued administration of this medicine. Bismuth subsalicylate has an aspirin equivalency conversion factor of 0.479 (approximately half the strength of aspirin). For 3.5 weeks the infant's parents administered the medicine, which provided the equivalent of aspirin 57-84 mg/kg/day with no reported problems. However, on the day of admission the baby presented with central nervous system depression and respiratory distress. Assessment at a local emergency facility revealed metabolic acidosis; his serum salicylate concentration was 747 mg/L. After acute management, the patient was transferred to our hospital, where he was treated with whole bowel irrigation and alkalinization therapy. Subsequently, the baby required 4 days of management in the PICU and 2 additional days of observation in a general nursing unit before he was discharged home without incident. The parents had chosen Percy Medicine based on the picture of a baby on the front of the package and because of its placement on the shelf next to a drug their family physician had recommended previously. Salicylate-containing products are not routinely recommended for children aged 1 year or younger. The general public may assume that over-the-counter products are safe because they do not require a prescription. Health care professionals must be responsible for educating the public regarding risks associated with over-the-counter products and the need to read and follow label directions.",Aspirin; Nonprescription products; Pediatric; Salicylate toxicity,"Lewis, Teresa V.; Badillo, Randal; Schaeffer, Scott; Hagemann, Tracy M.; McGoodwin, Lee",2006,10.1592/phco.26.3.403,0,248
263,Institutional geographies in dying: Nurses' actions and observations on dying spaces inside and outside intensive care units,"This paper articulates the geographies associated with intensive care nursing work with dying patients and their families. Six focus groups were conducted with 27 registered critical care nurses who practice in hospitals in a mid-western city in the United States. The analysis is structured by three emerging themes (i) the importance of a 'good' and 'sacred' place, (ii) the body as mapped by medical specialties, and (iii) problems with procedurally driven suspension of 'do not resuscitate' orders beyond intensive care units (ICUs). Recommendations describe the need for institutional recognition of the moral importance of strong relationships between nurses, clients, and their families, and nurses' wide-ranging roles in bridging the various spatial domains of intensive care. © 2011 Elsevier Ltd.",Dying; Ethics; Families; Geography; Intensive care; Nursing work,"Liaschenko, Joan; Peden-McAlpine, Cynthia; Andrews, Gavin J.",2011,10.1016/j.healthplace.2011.03.004,0,249
264,Real-time subglottic stenosis imaging using optical coherence tomography in the rabbit,"Importance: Subglottic stenosis (SGS) is a severe, acquired, potentially life-threatening disease that can be caused by endotracheal tube intubation. Newborns and neonates are particularly susceptible to SGS owing to the small caliber of their airway. Objective: To demonstrate optical coherence tomography (OCT) capabilities in detecting injury and scar formation using a rabbit model. Optical coherence tomography may provide a noninvasive, bedside or intensive care unit modality for the identification of early airway trauma with the intention of preventing progression to SGS and can image the upper airway through an existing endotracheal tube coupled with a small fiber-optic probe. Design : Rabbits underwent suspension laryngoscopy with induction of of SGS via epithelial injury. This model was used to test and develop our advanced, high-speed, high-resolution OCT imaging system using a 3-dimensional microelectromechanical systems-based scanning device integrated with a fiber-optic probe to acquire high-resolution anatomic images of the subglottic epithelium and lamina propria. Setting: All experiments were performed at the Beckman Laser Institute animal operating room. Intervention or Exposure: Optical coherence tomography and endoscopy was performed with suspension laryngoscopy at 6 different time intervals and compared with conventional digital endoscopic images and histologic sections. Fifteen rabbits were killed at 3, 7, 14, 21, and 42 days after the induction of SGS. The laryngotracheal complexes were serially sectioned for histologic analysis. Main Outcome and Measure: Histologic sections, endoscopic images, andOCTimages were compared with one another to determine if OCT could accurately delineate the degree of SGS achieved. Results: The rabbit model was able to reliably and reproducibly achieve grade I SGS. The real-time OCT imaging system was able to (1) identify multiple structures in the airway; (2) delineate different tissue planes, such as the epithelium, basement membrane, lamina propria, and cartilage; and (3) detect changes in each tissue plane produced by trauma. Optical coherence tomography was also able demonstrate a clear picture of airway injury that correlated with the endoscopic and histologic images. With subjective review, 3 patients had high correlation between OCT and histologic images, 10 demonstrated some correlation with histologic images, and 2 showed little to no correlation with histologic images. Conclusions and Relevance: Optical coherence tomography, coupled with a fiber-optic probe, identifies subglottic scarring and can detect tissue changes in the rabbit airway to a depth of 1 mm. This technology brings us 1 step closer to minimally invasive subglottic airway monitoring in the intubated neonate, with the ultimate goal of preventing SGS and better managing the airway. ©2013 American Medical Association. All rights reserved.",,"Lin, Jennifer L.; Yau, Amy Y.; Boyd, Jonathon; Hamamoto, Ashley; Su, Erica; Tracey, Lauren; Heidari, Andrew E.; Wang, Alex H.; Ahuja, Gurpreet; Chen, Zhongping; Wong, Brian J.",2013,10.1001/jamaoto.2013.2643,0,250
265,Academic and educational outcomes of children with ADHD,"Attention-deficit/hyperactivity disorder (ADHD) is associated with poor grades, poor reading and math standardized test scores, and increased grade retention. ADHD is also associated with increased use of school-based services, increased rates of detention and expulsion, and ultimately with relatively low rates of high school graduation and postsecondary education. Children in community samples who show symptoms of inattention, hyperactivity, and impulsivity with or without formal diagnoses of ADHD also show poor academic and educational outcomes. Pharmacologic treatment and behavior management are associated with reduction of the core symptoms of ADHD and increased academic productivity, but not with improved standardized test scores or ultimate educational attainment. Future research must use conceptually based outcome measures in prospective, longitudinal, and community-based studies to determine which pharmacologic, behavioral, and educational interventions can improve academic and educational outcomes of children with ADHD. Copyright © 2007 by the Ambulatory Pediatric Association, published by Elsevier Inc.",Academic achievement; Attention-deficit/hyperactivity disorder; Behavior management; Education; Educational underachievement; Learning; Pharmacologic treatment; School-based services,"Loe, Irene M.; Feldman, Heidi M.",2007,10.1093/jpepsy/jsl054,1,251
266,Medical Expulsive Therapy is Underused for the Management of Renal Colic in the Emergency Setting,"Purpose Although the 2007 AUA (American Urological Association) guidelines established it as first line therapy for ureteral stones less than 10 mm, widespread adoption of medical expulsive therapy has been low. We determined the current penetrance of medical expulsive therapy guideline recommendations and the efficacy of medical expulsive therapy in reducing the requirement for urological procedures after emergency department visits for ureteral stones. Materials and Methods In a retrospective analysis of patients seen in the emergency department we included 2,105 emergency department visits associated with an ICD-9 diagnosis of urolithiasis in which computerized tomography abdomen/pelvis scan was performed. Outcomes were reviewed for spontaneous passage or required urological procedure. Results Ureteral stones were found in 48.8% of patients, including 50.0% in whom medical expulsive therapy was prescribed. There was no significant difference between patients who did and did not receive medical expulsive therapy. Within 12 weeks of the initial emergency department visit there was no difference in the rate of urological procedures performed in those who received medical expulsive therapy or in the rate of return to the emergency department. Patients treated with medical expulsive therapy experienced a shorter time to spontaneous expulsion (7.1 vs 12.8 days, p = 0.048). Conclusions Medical expulsive therapy for renal colic in the emergency setting remains underused. Half of the patients who met criteria for medical expulsive therapy in this study did not receive the standard of care. Patients treated with medical expulsive therapy achieved spontaneous passage more quickly but there was no difference in the requirement for a urological procedure. These results highlight the need for personnel at emergency departments to better standardize care for patients with ureteral stones.","emergency service, hospital; kidney; standard of care; ureter; urolithiasis","Loftus, Christopher; Nyame, Yaw; Hinck, Bryan; Greene, Daniel; Chaparala, Hemant; Alazem, Kareem; Monga, Manoj",2016,10.1016/j.juro.2015.11.026,0,252
